movie_title,director_name,actor_1_name,actor_2_name,actor_3_name,genres,comb,id
elmer gantry,RichardBrooks,ShirleyJones,JeanSimmons,EdwardAndrews,Drama,ShirleyJones JeanSimmons EdwardAndrews RichardBrooks Drama,
judgment at nuremberg,StanleyKramer,MaximilianSchell,MontgomeryClift,SpencerTracy,Drama  War,MaximilianSchell MontgomeryClift SpencerTracy StanleyKramer Drama  War,
trippin',DavidRaynr,DonaldFaison,DeonRichmond,CountessVaughn,Comedy,DonaldFaison DeonRichmond CountessVaughn DavidRaynr Comedy,
robot chicken            ,unknown,MatthewSenreich,SethGreen,BreckinMeyer,Animation  Comedy,MatthewSenreich SethGreen BreckinMeyer unknown Animation  Comedy,
red river,HowardHawks,MontgomeryClift,WalterBrennan,HarryCareyJr.,Action  Adventure  Romance  Western,MontgomeryClift WalterBrennan HarryCareyJr. HowardHawks Action  Adventure  Romance  Western,
phat girlz,NnegestLikké,Mo'Nique,JimmyJean-Louis,JoyfulDrake,Comedy,Mo'Nique JimmyJean-Louis JoyfulDrake NnegestLikké Comedy,
before midnight,RichardLinklater,SeamusDavey-Fitzpatrick,ArianeLabed,AthinaRachelTsangari,Drama  Romance,SeamusDavey-Fitzpatrick ArianeLabed AthinaRachelTsangari RichardLinklater Drama  Romance,
teen wolf too,ChristopherLeitch,JohnAstin,RobertNeary,KimDarby,Comedy  Fantasy,JohnAstin RobertNeary KimDarby ChristopherLeitch Comedy  Fantasy,
phantasm ii,DonCoscarelli,AngusScrimm,A.MichaelBaldwin,JamesLeGros,Action  Fantasy  Horror  Sci-Fi  Thriller,AngusScrimm A.MichaelBaldwin JamesLeGros DonCoscarelli Action  Fantasy  Horror  Sci-Fi  Thriller,
woman thou art loosed,MichaelSchultz,LorettaDevine,KimberlyElise,CliftonPowell,Drama,LorettaDevine KimberlyElise CliftonPowell MichaelSchultz Drama,
real women have curves,PatriciaCardoso,AmericaFerrera,LupeOntiveros,GeorgeLopez,Comedy  Drama,AmericaFerrera LupeOntiveros GeorgeLopez PatriciaCardoso Comedy  Drama,
deadline gallipoli            ,unknown,RachelGriffiths,JessicaDeGouw,LukeFord,Drama  War,RachelGriffiths JessicaDeGouw LukeFord unknown Drama  War,
water,DeepaMehta,JohnAbraham,LisaRay,SeemaBiswas,Drama  Romance,JohnAbraham LisaRay SeemaBiswas DeepaMehta Drama  Romance,
east is east,DamienO'Donnell,ArchiePanjabi,JimiMistry,OmPuri,Comedy  Drama,ArchiePanjabi JimiMistry OmPuri DamienO'Donnell Comedy  Drama,
whipped,PeterM.Cohen,CallieThorne,BrianVanHolt,DavidHeyman,Comedy  Romance,CallieThorne BrianVanHolt DavidHeyman PeterM.Cohen Comedy  Romance,
kama sutra: a tale of love,MiraNair,IndiraVarma,SaritaChoudhury,Rekha,Crime  Drama  History  Romance,IndiraVarma SaritaChoudhury Rekha MiraNair Crime  Drama  History  Romance,
please give,NicoleHolofcener,OliverPlatt,ThomasIanNicholas,AnnMorganGuilbert,Comedy  Drama,OliverPlatt ThomasIanNicholas AnnMorganGuilbert NicoleHolofcener Comedy  Drama,
willy wonka & the chocolate factory,MelStuart,PeterOstrum,JackAlbertson,JulieDawnCole,Family  Fantasy  Musical,PeterOstrum JackAlbertson JulieDawnCole MelStuart Family  Fantasy  Musical,
warlock: the armageddon,AnthonyHickox,JulianSands,ZachGalligan,PaulaMarshall,Fantasy  Horror,JulianSands ZachGalligan PaulaMarshall AnthonyHickox Fantasy  Horror,
8 heads in a duffel bag,TomSchulman,KristySwanson,GeorgeHamilton,DyanCannon,Comedy  Crime,KristySwanson GeorgeHamilton DyanCannon TomSchulman Comedy  Crime,
days of heaven,TerrenceMalick,SamShepard,StuartMargolin,RichardLibertini,Drama  Romance,SamShepard StuartMargolin RichardLibertini TerrenceMalick Drama  Romance,
thirteen conversations about one thing,JillSprecher,MatthewMcConaughey,RobMcElhenney,AmyIrving,Drama,MatthewMcConaughey RobMcElhenney AmyIrving JillSprecher Drama,
jawbreaker,DarrenStein,JulieBenz,JudyGreer,JeffConaway,Comedy  Crime  Thriller,JulieBenz JudyGreer JeffConaway DarrenStein Comedy  Crime  Thriller,
basquiat,JulianSchnabel,GaryOldman,MichaelWincott,CourtneyLove,Biography  Drama,GaryOldman MichaelWincott CourtneyLove JulianSchnabel Biography  Drama,
frances ha,NoahBaumbach,GretaGerwig,GraceGummer,VanessaRay,Comedy  Drama  Romance,GretaGerwig GraceGummer VanessaRay NoahBaumbach Comedy  Drama  Romance,
tsotsi,GavinHood,TerryPheto,NambithaMpumlwana,RapulanaSeiphemo,Crime  Drama,TerryPheto NambithaMpumlwana RapulanaSeiphemo GavinHood Crime  Drama,
happiness,ToddSolondz,PhilipSeymourHoffman,JonLovitz,DylanBaker,Comedy  Drama,PhilipSeymourHoffman JonLovitz DylanBaker ToddSolondz Comedy  Drama,
dysfunktional family,GeorgeGallo,EddieGriffin,JoeHoward,RobertNoble,Comedy  Documentary,EddieGriffin JoeHoward RobertNoble GeorgeGallo Comedy  Documentary,
tusk,KevinSmith,JohnnyDepp,HaleyJoelOsment,MichaelParks,Comedy  Drama  Horror,JohnnyDepp HaleyJoelOsment MichaelParks KevinSmith Comedy  Drama  Horror,
oldboy,Chan-wookPark,Min-sikChoi,Ji-taeYu,Hye-jeongKang,Drama  Mystery  Thriller,Min-sikChoi Ji-taeYu Hye-jeongKang Chan-wookPark Drama  Mystery  Thriller,
letters to god,DavidNixon,RobynLively,MichaelBolten,ChristopherSchmidt,Drama  Family,RobynLively MichaelBolten ChristopherSchmidt DavidNixon Drama  Family,
hobo with a shotgun,JasonEisener,GregorySmith,RobbWells,MollyDunsworth,Action  Comedy  Thriller,GregorySmith RobbWells MollyDunsworth JasonEisener Action  Comedy  Thriller,
compadres,EnriqueBegne,KevinPollak,HéctorJiménez,ErickElias,Action  Comedy,KevinPollak HéctorJiménez ErickElias EnriqueBegne Action  Comedy,
freeway,MatthewBright,BokeemWoodbine,DanHedaya,RobertPeters,Comedy  Crime  Drama  Thriller,BokeemWoodbine DanHedaya RobertPeters MatthewBright Comedy  Crime  Drama  Thriller,
love's abiding joy,MichaelLandonJr.,WilliamMorganSheppard,KevinGage,BriannaBrown,Drama  Family  Western,WilliamMorganSheppard KevinGage BriannaBrown MichaelLandonJr. Drama  Family  Western,
fish tank,AndreaArnold,MichaelFassbender,HarryTreadaway,JasonMaza,Drama,MichaelFassbender HarryTreadaway JasonMaza AndreaArnold Drama,
damsels in distress,WhitStillman,GretaGerwig,MegalynEchikunwoke,ZachWoods,Comedy  Drama  Romance,GretaGerwig MegalynEchikunwoke ZachWoods WhitStillman Comedy  Drama  Romance,
creature            ,unknown,CraigT.Nelson,ColmFeore,MegalynEchikunwoke,Horror  Sci-Fi  Thriller,CraigT.Nelson ColmFeore MegalynEchikunwoke unknown Horror  Sci-Fi  Thriller,
bachelorette,LeslyeHeadland,KirstenDunst,AdamScott,AndrewRannells,Comedy  Romance,KirstenDunst AdamScott AndrewRannells LeslyeHeadland Comedy  Romance,
braindead            ,unknown,DannyPino,MeganHilty,ZachGrenier,Comedy  Drama  Horror  Sci-Fi  Thriller,DannyPino MeganHilty ZachGrenier unknown Comedy  Drama  Horror  Sci-Fi  Thriller,
brave new girl,BobbyRoth,VirginiaMadsen,AaronAshmore,LindseyHaun,Drama  Family  Music,VirginiaMadsen AaronAshmore LindseyHaun BobbyRoth Drama  Family  Music,
tim and eric's billion dollar movie,TimHeidecker,MichaelGross,WilliamAtherton,BobRoss,Comedy,MichaelGross WilliamAtherton BobRoss TimHeidecker Comedy,
the gambler,RupertWyatt,GeorgeKennedy,CjonSaulsberry,GriffinCleveland,Crime  Drama  Thriller,GeorgeKennedy CjonSaulsberry GriffinCleveland RupertWyatt Crime  Drama  Thriller,
the grand            ,unknown,SusanHampshire,AmandaMealing,TimHealy,Drama,SusanHampshire AmandaMealing TimHealy unknown Drama,
summer storm,MarcoKreuzpaintner,AlicjaBachleda,KostjaUllmann,RobertStadlober,Comedy  Drama  Romance  Sport,AlicjaBachleda KostjaUllmann RobertStadlober MarcoKreuzpaintner Comedy  Drama  Romance  Sport,
fort mccoy,KateConnor,JohnnyPacar,EricStoltz,BrendanFehr,Drama  History  War,JohnnyPacar EricStoltz BrendanFehr KateConnor Drama  History  War,
chain letter,DeonTaylor,MattCohen,BetsyRussell,NoahSegan,Horror  Thriller,MattCohen BetsyRussell NoahSegan DeonTaylor Horror  Thriller,
just looking,JasonAlexander,GretchenMol,PattiLuPone,PeterOnorati,Comedy  Drama,GretchenMol PattiLuPone PeterOnorati JasonAlexander Comedy  Drama,
the divide,XavierGens,MichaelBiehn,LaurenGerman,RosannaArquette,Drama  Sci-Fi  Thriller,MichaelBiehn LaurenGerman RosannaArquette XavierGens Drama  Sci-Fi  Thriller,
the eclipse,ConorMcPherson,AidanQuinn,IbenHjejle,JimNorton,Drama  Horror  Romance,AidanQuinn IbenHjejle JimNorton ConorMcPherson Drama  Horror  Romance,
demonic,WillCanon,FrankGrillo,ScottMechlowicz,AaronYoo,Horror  Thriller,FrankGrillo ScottMechlowicz AaronYoo WillCanon Horror  Thriller,
my big fat independent movie,PhilipZlotorynski,NeilHopkins,DarrenKeefeReiher,DavidDouglas,Comedy,NeilHopkins DarrenKeefeReiher DavidDouglas PhilipZlotorynski Comedy,
alice in wonderland,TimBurton,JohnnyDepp,AlanRickman,AnneHathaway,Adventure  Family  Fantasy,JohnnyDepp AlanRickman AnneHathaway TimBurton Adventure  Family  Fantasy,
the deported,LanceKawas,TaylorNegron,MichaelRapaport,TaliaShire,Comedy,TaylorNegron MichaelRapaport TaliaShire LanceKawas Comedy,
tanner hall,FrancescaGregorini,TomEverettScott,AmySedaris,ChrisKattan,Drama,TomEverettScott AmySedaris ChrisKattan FrancescaGregorini Drama,
open road,MarcioGarcia,JohnSavage,KristiClainos,EmilyNelson,Action  Drama  Thriller,JohnSavage KristiClainos EmilyNelson MarcioGarcia Action  Drama  Thriller,
they came together,DavidWain,ChristopherMeloni,AmyPoehler,JackMcBrayer,Comedy,ChristopherMeloni AmyPoehler JackMcBrayer DavidWain Comedy,
30 nights of paranormal activity with the devil inside the girl with the dragon tattoo,CraigMoss,FrenchStewart,AshleyMartin,OliviaAlexander,Comedy,FrenchStewart AshleyMartin OliviaAlexander CraigMoss Comedy,
never back down 2: the beatdown,MichaelJaiWhite,MichaelJaiWhite,AlexMeraz,JillianMurray,Action  Drama  Sport,MichaelJaiWhite AlexMeraz JillianMurray MichaelJaiWhite Action  Drama  Sport,
point blank,JohnBoorman,LeeMarvin,AngieDickinson,CarrollO'Connor,Crime  Thriller,LeeMarvin AngieDickinson CarrollO'Connor JohnBoorman Crime  Thriller,
four single fathers,PaoloMonico,StephanieSzostak,SarahRafferty,SalvatoreSantone,Comedy,StephanieSzostak SarahRafferty SalvatoreSantone PaoloMonico Comedy,
enter the dangerous mind,YoussefDelara,NoelGugliemi,DavidBianchi,JasonPriestley,Thriller,NoelGugliemi DavidBianchi JasonPriestley YoussefDelara Thriller,
something wicked,DarinScott,JulianMorris,ShantelVanSanten,JohnRobinson,Drama  Horror  Mystery  Thriller,JulianMorris ShantelVanSanten JohnRobinson DarinScott Drama  Horror  Mystery  Thriller,
awol-72,ChristianSesma,BokeemWoodbine,BrookeNewton,BrettWagner,Thriller,BokeemWoodbine BrookeNewton BrettWagner ChristianSesma Thriller,
iguana,MonteHellman,EverettMcGill,JackTaylor,FabioTesti,Adventure  Crime  Drama,EverettMcGill JackTaylor FabioTesti MonteHellman Adventure  Crime  Drama,
cinderella,KennethBranagh,HayleyAtwell,DerekJacobi,LilyJames,Drama  Family  Fantasy  Romance,HayleyAtwell DerekJacobi LilyJames KennethBranagh Drama  Family  Fantasy  Romance,
chicago overcoat,BrianCaunter,MikeStarr,StacyKeach,FrankVincent,Action  Adventure  Crime  Drama,MikeStarr StacyKeach FrankVincent BrianCaunter Action  Adventure  Crime  Drama,
barry munday,ChrisD'Arienzo,JudyGreer,CybillShepherd,SheaWhigham,Comedy  Drama  Romance,JudyGreer CybillShepherd SheaWhigham ChrisD'Arienzo Comedy  Drama  Romance,
central station,WalterSalles,FernandaMontenegro,MatheusNachtergaele,OthonBastos,Drama,FernandaMontenegro MatheusNachtergaele OthonBastos WalterSalles Drama,
pocketful of miracles,FrankCapra,Ann-Margret,GlennFord,ThomasMitchell,Comedy  Drama,Ann-Margret GlennFord ThomasMitchell FrankCapra Comedy  Drama,
close range,IsaacFlorentine,AnthonyL.Fernandez,NickChinlund,ScottEvans,Action  Crime,AnthonyL.Fernandez NickChinlund ScottEvans IsaacFlorentine Action  Crime,
boynton beach club,SusanSeidelman,DyanCannon,MichaelNouri,BrendaVaccaro,Comedy  Romance,DyanCannon MichaelNouri BrendaVaccaro SusanSeidelman Comedy  Romance,
amnesiac,MichaelPolish,OliviaRoseKeegan,PatrickBauchau,MiaBarron,Drama  Horror  Mystery  Thriller,OliviaRoseKeegan PatrickBauchau MiaBarron MichaelPolish Drama  Horror  Mystery  Thriller,
freakonomics,HeidiEwing,GregCrowe,JamesRansone,TempesttBledsoe,Documentary,GregCrowe JamesRansone TempesttBledsoe HeidiEwing Documentary,
the omen,RichardDonner,LeeRemick,PatrickTroughton,BillieWhitelaw,Fantasy  Horror  Mystery,LeeRemick PatrickTroughton BillieWhitelaw RichardDonner Fantasy  Horror  Mystery,
high tension,AlexandreAja,CécileDeFrance,Maïwenn,OanaPellea,Horror,CécileDeFrance Maïwenn OanaPellea AlexandreAja Horror,
griff the invisible,LeonFord,MaeveDermody,PatrickBrammall,KellyPaterniti,Comedy  Drama  Romance  Sci-Fi,MaeveDermody PatrickBrammall KellyPaterniti LeonFord Comedy  Drama  Romance  Sci-Fi,
unnatural,HankBraxtan,Q'oriankaKilcher,GregoryCruz,AllegraCarpenter,Action  Horror  Thriller,Q'oriankaKilcher GregoryCruz AllegraCarpenter HankBraxtan Action  Horror  Thriller,
hustle & flow,CraigBrewer,IsaacHayes,PaulaJaiParker,EliseNeal,Crime  Drama  Music,IsaacHayes PaulaJaiParker EliseNeal CraigBrewer Crime  Drama  Music,
some like it hot,BillyWilder,NehemiahPersoff,JoeE.Brown,GeorgeRaft,Comedy  Music  Romance,NehemiahPersoff JoeE.Brown GeorgeRaft BillyWilder Comedy  Music  Romance,
friday the 13th part vii: the new blood,JohnCarlBuechler,KaneHodder,TerryKiser,WilliamButler,Horror,KaneHodder TerryKiser WilliamButler JohnCarlBuechler Horror,
the wizard of oz,VictorFleming,MargaretHamilton,Terry,BillieBurke,Adventure  Family  Fantasy  Musical,MargaretHamilton Terry BillieBurke VictorFleming Adventure  Family  Fantasy  Musical,
young frankenstein,MelBrooks,MadelineKahn,PeterBoyle,TeriGarr,Comedy,MadelineKahn PeterBoyle TeriGarr MelBrooks Comedy,
diary of the dead,GeorgeA.Romero,MeganPark,ShawnRoberts,JoeDinicol,Horror,MeganPark ShawnRoberts JoeDinicol GeorgeA.Romero Horror,
lage raho munna bhai,RajkumarHirani,VidyaBalan,SanjayDutt,JimmyShergill,Comedy  Drama  Romance,VidyaBalan SanjayDutt JimmyShergill RajkumarHirani Comedy  Drama  Romance,
ulee's gold,VictorNunez,PeterFonda,PatriciaRichardson,VanessaZima,Drama,PeterFonda PatriciaRichardson VanessaZima VictorNunez Drama,
the black stallion,CarrollBallard,TeriGarr,KellyReno,HoytAxton,Adventure  Family  Sport,TeriGarr KellyReno HoytAxton CarrollBallard Adventure  Family  Sport,
sardaar ji,RohitJugraj,BhavkhandanSinghRakhra,NeeruBajwa,DiljitDosanjh,Romance,BhavkhandanSinghRakhra NeeruBajwa DiljitDosanjh RohitJugraj Romance,
journey to saturn,ThorbjørnChristoffersen,IbenHjejle,FrankHvam,CasperChristensen,Action  Adventure  Animation  Comedy  Sci-Fi,IbenHjejle FrankHvam CasperChristensen ThorbjørnChristoffersen Action  Adventure  Animation  Comedy  Sci-Fi,
donovan's reef,JohnFord,LeeMarvin,CesarRomero,JackWarden,Adventure  Comedy  Romance,LeeMarvin CesarRomero JackWarden JohnFord Adventure  Comedy  Romance,
the dress,AlexvanWarmerdam,RijkdeGooyer,ArianeSchluter,HenriGarcin,Comedy  Drama,RijkdeGooyer ArianeSchluter HenriGarcin AlexvanWarmerdam Comedy  Drama,
a guy named joe,VictorFleming,SpencerTracy,EstherWilliams,IreneDunne,Drama  Fantasy  Romance  War,SpencerTracy EstherWilliams IreneDunne VictorFleming Drama  Fantasy  Romance  War,
blazing saddles,MelBrooks,MadelineKahn,DavidHuddleston,HarveyKorman,Comedy  Western,MadelineKahn DavidHuddleston HarveyKorman MelBrooks Comedy  Western,
friday the 13th: the final chapter,JosephZito,JudieAronson,TomEverett,KimberlyBeck,Horror  Thriller,JudieAronson TomEverett KimberlyBeck JosephZito Horror  Thriller,
ida,PawelPawlikowski,JoannaKulig,AgataTrzebuchowska,AgataKulesza,Drama,JoannaKulig AgataTrzebuchowska AgataKulesza PawelPawlikowski Drama,
maurice,JamesIvory,RupertGraves,DenholmElliott,SimonCallow,Drama  Romance,RupertGraves DenholmElliott SimonCallow JamesIvory Drama  Romance,
beer league,FrankSebastiano,JoeLoTruglio,LaurieMetcalf,SeymourCassel,Comedy  Sport,JoeLoTruglio LaurieMetcalf SeymourCassel FrankSebastiano Comedy  Sport,
the astronaut's wife,RandRavich,JohnnyDepp,CharlizeTheron,CleaDuVall,Drama  Sci-Fi  Thriller,JohnnyDepp CharlizeTheron CleaDuVall RandRavich Drama  Sci-Fi  Thriller,
riding giants,StacyPeralta,GerryLopez,GabrielleReece,LairdJohnHamilton,Documentary  History  Sport,GerryLopez GabrielleReece LairdJohnHamilton StacyPeralta Documentary  History  Sport,
timecrimes,NachoVigalondo,KarraElejalde,NachoVigalondo,BárbaraGoenaga,Horror  Mystery  Sci-Fi  Thriller,KarraElejalde NachoVigalondo BárbaraGoenaga NachoVigalondo Horror  Mystery  Sci-Fi  Thriller,
silver medallist,HaoNing,JackKao,BoHuang,ZhengXu,Action  Adventure  Comedy,JackKao BoHuang ZhengXu HaoNing Action  Adventure  Comedy,
timber falls,TonyGiglio,BriannaBrown,NickSearcy,BethBroderick,Horror  Thriller,BriannaBrown NickSearcy BethBroderick TonyGiglio Horror  Thriller,
singin' in the rain,StanleyDonen,RitaMoreno,DebbieReynolds,CydCharisse,Comedy  Musical  Romance,RitaMoreno DebbieReynolds CydCharisse StanleyDonen Comedy  Musical  Romance,
"fat, sick & nearly dead",JoeCross,JoeCross,JoelFuhrman,AmyBadberg,Documentary,JoeCross JoelFuhrman AmyBadberg JoeCross Documentary,
a haunted house,MichaelTiddes,EssenceAtkins,AlannaUbach,J.B.Smoove,Comedy  Fantasy,EssenceAtkins AlannaUbach J.B.Smoove MichaelTiddes Comedy  Fantasy,
2016: obama's america,DineshD'Souza,BarackObama,ZackaryStevenGraham,DineshD'Souza,Documentary,BarackObama ZackaryStevenGraham DineshD'Souza DineshD'Souza Documentary,
halloween ii,RobZombie,ScoutTaylor-Compton,TylerMane,MargotKidder,Horror,ScoutTaylor-Compton TylerMane MargotKidder RobZombie Horror,
that thing you do!,TomHanks,TomHanks,CharlizeTheron,EthanEmbry,Comedy  Drama  Music,TomHanks CharlizeTheron EthanEmbry TomHanks Comedy  Drama  Music,
halloween iii: season of the witch,TommyLeeWallace,TomAtkins,DanO'Herlihy,NancyKyes,Horror  Mystery  Sci-Fi,TomAtkins DanO'Herlihy NancyKyes TommyLeeWallace Horror  Mystery  Sci-Fi,
escape from the planet of the apes,DonTaylor,RoddyMcDowall,M.EmmetWalsh,SalMineo,Action  Sci-Fi,RoddyMcDowall M.EmmetWalsh SalMineo DonTaylor Action  Sci-Fi,
hud,MartinRitt,PatriciaNeal,MelvynDouglas,WhitBissell,Drama,PatriciaNeal MelvynDouglas WhitBissell MartinRitt Drama,
kevin hart: let me explain,LeslieSmall,DavidJasonPerez,La'PrincessJackson,DanaHanna,Comedy  Documentary,DavidJasonPerez La'PrincessJackson DanaHanna LeslieSmall Comedy  Documentary,
my own private idaho,GusVanSant,KeanuReeves,UdoKier,Flea,Drama,KeanuReeves UdoKier Flea GusVanSant Drama,
garden state,ZachBraff,ArmandoRiesco,MichaelWeston,JillFlint,Comedy  Drama  Romance,ArmandoRiesco MichaelWeston JillFlint ZachBraff Comedy  Drama  Romance,
before sunrise,RichardLinklater,HannoPöschl,HansWeingartner,DominikCastell,Drama  Romance,HannoPöschl HansWeingartner DominikCastell RichardLinklater Drama  Romance,
sur le seuil,ÉricTessier,PatrickHuard,MichelCôté,JeanPierreBergeron,Action  Drama  Horror  Thriller,PatrickHuard MichelCôté JeanPierreBergeron ÉricTessier Action  Drama  Horror  Thriller,
jesus' son,AlisonMaclean,BillyCrudup,SamanthaMorton,MarkWebber,Drama,BillyCrudup SamanthaMorton MarkWebber AlisonMaclean Drama,
saving face,AliceWu,JoanChen,AtoEssandoh,JessicaHecht,Comedy  Drama  Romance,JoanChen AtoEssandoh JessicaHecht AliceWu Comedy  Drama  Romance,
brick lane,SarahGavron,SatishKaushik,ChristopherSimpson,TannishthaChatterjee,Drama,SatishKaushik ChristopherSimpson TannishthaChatterjee SarahGavron Drama,
robot & frank,JakeSchreier,FrankLangella,JoshuaOrmond,AnaGasteyer,Comedy  Crime  Drama  Sci-Fi,FrankLangella JoshuaOrmond AnaGasteyer JakeSchreier Comedy  Crime  Drama  Sci-Fi,
my life without me,IsabelCoixet,SarahPolley,JulianRichings,AmandaPlummer,Drama  Romance,SarahPolley JulianRichings AmandaPlummer IsabelCoixet Drama  Romance,
the spectacular now,JamesPonsoldt,ShaileneWoodley,JenniferJasonLeigh,DayoOkeniyi,Comedy  Drama  Romance,ShaileneWoodley JenniferJasonLeigh DayoOkeniyi JamesPonsoldt Comedy  Drama  Romance,
marilyn hotchkiss' ballroom dancing and charm school,RandallMiller,WilliamHurt,EldenHenson,MichaelBower,Comedy  Family  Musical  Romance  Short,WilliamHurt EldenHenson MichaelBower RandallMiller Comedy  Family  Musical  Romance  Short,
religulous,LarryCharles,BillMaher,TalBachman,SteveBurg,Comedy  Documentary  War,BillMaher TalBachman SteveBurg LarryCharles Comedy  Documentary  War,
fuel,JoshuaTickell,LarryDavid,SherylCrow,GeorgeW.Bush,Documentary,LarryDavid SherylCrow GeorgeW.Bush JoshuaTickell Documentary,
valley of the heart's delight,TimBoxell,BruceMcGill,DianaScarwid,TomBower,Drama,BruceMcGill DianaScarwid TomBower TimBoxell Drama,
dodgeball: a true underdog story,RawsonMarshallThurber,GaryCole,StephenRoot,JoelDavidMoore,Comedy  Sport,GaryCole StephenRoot JoelDavidMoore RawsonMarshallThurber Comedy  Sport,
eye of the dolphin,MichaelD.Sellers,KatharineRoss,CarlySchroeder,GeorgeHarris,Comedy  Drama  Family,KatharineRoss CarlySchroeder GeorgeHarris MichaelD.Sellers Comedy  Drama  Family,
8: the mormon proposition,ReedCowan,DustinLanceBlack,EmilyPearson,GavinNewsom,Documentary,DustinLanceBlack EmilyPearson GavinNewsom ReedCowan Documentary,
the other end of the line,JamesDodson,LarryMiller,AnupamKher,ShriyaSaran,Comedy  Drama  Romance,LarryMiller AnupamKher ShriyaSaran JamesDodson Comedy  Drama  Romance,
anatomy,StefanRuzowitzky,BennoFürmann,RüdigerVogler,SebastianBlomberg,Horror  Thriller,BennoFürmann RüdigerVogler SebastianBlomberg StefanRuzowitzky Horror  Thriller,
sleep dealer,AlexRivera,LeonorVarela,JacobVargas,TenochHuerta,Drama  Romance  Sci-Fi  Thriller,LeonorVarela JacobVargas TenochHuerta AlexRivera Drama  Romance  Sci-Fi  Thriller,
super,JamesGunn,LindaCardellini,RainnWilson,PaulT.Taylor,Comedy  Crime  Drama,LindaCardellini RainnWilson PaulT.Taylor JamesGunn Comedy  Crime  Drama,
christmas mail,JohnMurlowski,AshleyScott,PiperMackenzieHarris,LochlynMunro,Comedy  Drama  Family  Romance,AshleyScott PiperMackenzieHarris LochlynMunro JohnMurlowski Comedy  Drama  Family  Romance,
stung,BenniDiez,CliftonCollinsJr.,CeciliaPillado,DavidMasterson,Comedy  Horror,CliftonCollinsJr. CeciliaPillado DavidMasterson BenniDiez Comedy  Horror,
antibirth,DannyPerez,NatashaLyonne,EmmanuelKabongo,MarkWebber,Horror,NatashaLyonne EmmanuelKabongo MarkWebber DannyPerez Horror,
get on the bus,SpikeLee,BernieMac,HarryLennix,AndreBraugher,Drama  History,BernieMac HarryLennix AndreBraugher SpikeLee Drama  History,
thr3e,RobbyHenson,MarcBlucas,MaxRyan,JustineWaddell,Drama  Horror  Mystery  Thriller,MarcBlucas MaxRyan JustineWaddell RobbyHenson Drama  Horror  Mystery  Thriller,
idiocracy,MikeJudge,Anthony'Citric'Campos,PatrickFischler,DavidHerman,Adventure  Comedy  Sci-Fi,Anthony'Citric'Campos PatrickFischler DavidHerman MikeJudge Adventure  Comedy  Sci-Fi,
the rise of the krays,ZackaryAdler,SimonMerrells,KevinLeslie,KrisSommerville,Crime  Drama,SimonMerrells KevinLeslie KrisSommerville ZackaryAdler Crime  Drama,
this is england,ShaneMeadows,StephenGraham,JosephGilgun,JackO'Connell,Crime  Drama,StephenGraham JosephGilgun JackO'Connell ShaneMeadows Crime  Drama,
alien uprising,DominicBurns,JulianGlover,SeanPertwee,BiancaBrigitteVanDamme,Comedy  Sci-Fi,JulianGlover SeanPertwee BiancaBrigitteVanDamme DominicBurns Comedy  Sci-Fi,
bathing beauty,GeorgeSidney,EstherWilliams,BasilRathbone,RedSkelton,Comedy  Musical,EstherWilliams BasilRathbone RedSkelton GeorgeSidney Comedy  Musical,
go for it!,CarmenMarron,JossaraJinaro,AimeeGarcia,ReneRosado,Drama  Musical,JossaraJinaro AimeeGarcia ReneRosado CarmenMarron Drama  Musical,
"dancer, texas pop. 81",TimMcCanlies,EthanEmbry,MichaelO'Neill,AlexandraHolden,Comedy  Drama  Family,EthanEmbry MichaelO'Neill AlexandraHolden TimMcCanlies Comedy  Drama  Family,
show boat,GeorgeSidney,AgnesMoorehead,AvaGardner,HowardKeel,Drama  Family  Musical  Romance,AgnesMoorehead AvaGardner HowardKeel GeorgeSidney Drama  Family  Musical  Romance,
redemption road,MarioVanPeebles,TomSkerritt,CindaMcCain,LukePerry,Drama,TomSkerritt CindaMcCain LukePerry MarioVanPeebles Drama,
the brave little toaster,JerryRees,JonLovitz,PhilHartman,MindySterling,Adventure  Animation  Comedy  Family  Fantasy  Musical,JonLovitz PhilHartman MindySterling JerryRees Adventure  Animation  Comedy  Family  Fantasy  Musical,
fantasia,JamesAlgar,LeopoldStokowski,DeemsTaylor,unknown,Animation  Family  Fantasy  Music,LeopoldStokowski DeemsTaylor unknown JamesAlgar Animation  Family  Fantasy  Music,
the french connection,WilliamFriedkin,RoyScheider,FernandoRey,TonyLoBianco,Action  Crime  Drama  Thriller,RoyScheider FernandoRey TonyLoBianco WilliamFriedkin Action  Crime  Drama  Thriller,
8 days,JacoBooyens,NicoleSmolen,SebastianAguilar,IvetteAlvarez,Drama  Thriller,NicoleSmolen SebastianAguilar IvetteAlvarez JacoBooyens Drama  Thriller,
friday the 13th part iii,SteveMiner,RichardBrooker,DanaKimmell,CatherineParks,Horror  Thriller,RichardBrooker DanaKimmell CatherineParks SteveMiner Horror  Thriller,
friday the 13th: a new beginning,DannySteinmann,TiffanyHelm,MelanieKinnaman,DominickBrascia,Horror  Mystery  Thriller,TiffanyHelm MelanieKinnaman DominickBrascia DannySteinmann Horror  Mystery  Thriller,
the last sin eater,MichaelLandonJr.,HenryThomas,LouiseFletcher,A.J.Buckley,Drama,HenryThomas LouiseFletcher A.J.Buckley MichaelLandonJr. Drama,
do you believe?,JonGunn,AlexaPenaVega,DelroyLindo,MadisonPettis,Drama,AlexaPenaVega DelroyLindo MadisonPettis JonGunn Drama,
impact point,HayleyCloake,BrianAustinGreen,KaylaEwell,LindenAshby,Thriller,BrianAustinGreen KaylaEwell LindenAshby HayleyCloake Thriller,
the valley of decision,TayGarnett,JessicaTandy,GreerGarson,LionelBarrymore,Drama,JessicaTandy GreerGarson LionelBarrymore TayGarnett Drama,
eden,ShyamMadiraju,JessicaLowndes,EthanPeck,BradSchmidt,Drama  Thriller,JessicaLowndes EthanPeck BradSchmidt ShyamMadiraju Drama  Thriller,
chicken tikka masala,HarmageSinghKalirai,SaeedJaffrey,ZohraSegal,ShobuKapoor,Comedy  Drama  Romance,SaeedJaffrey ZohraSegal ShobuKapoor HarmageSinghKalirai Comedy  Drama  Romance,
always woodstock,RitaMerson,RyanGuzman,JamesWolk,JasonRitter,Comedy  Music  Romance,RyanGuzman JamesWolk JasonRitter RitaMerson Comedy  Music  Romance,
jack brooks: monster slayer,JonKnautz,RachelSkarsten,DanielKash,StefanieDrummond,Action  Comedy  Horror,RachelSkarsten DanielKash StefanieDrummond JonKnautz Action  Comedy  Horror,
the best years of our lives,WilliamWyler,MyrnaLoy,TeresaWright,DanaAndrews,Drama  Romance  War,MyrnaLoy TeresaWright DanaAndrews WilliamWyler Drama  Romance  War,
