movie_title,director_name,actor_1_name,actor_2_name,actor_3_name,genres,comb,id
the intern,NancyMeyers,RobertDeNiro,AnneHathaway,ReneRusso,Comedy  Drama,RobertDeNiro AnneHathaway ReneRusso NancyMeyers Comedy  Drama,
ride along 2,TimStory,OliviaMunn,NadineVelazquez,BruceMcGill,Action  Comedy,OliviaMunn NadineVelazquez BruceMcGill TimStory Action  Comedy,
the last of the mohicans,MichaelMann,WesStudi,TerryKinney,EricSchweig,Action  Adventure  Drama  Romance  War,WesStudi TerryKinney EricSchweig MichaelMann Action  Adventure  Drama  Romance  War,
ray,TaylorHackford,BokeemWoodbine,CurtisArmstrong,HarryLennix,Biography  Drama  Music,BokeemWoodbine CurtisArmstrong HarryLennix TaylorHackford Biography  Drama  Music,
sin city,FrankMiller,RosarioDawson,PowersBoothe,JasonDouglas,Crime  Thriller,RosarioDawson PowersBoothe JasonDouglas FrankMiller Crime  Thriller,
vantage point,PeteTravis,DennisQuaid,EdgarRamírez,WilliamHurt,Crime  Drama  Mystery  Thriller,DennisQuaid EdgarRamírez WilliamHurt PeteTravis Crime  Drama  Mystery  Thriller,
"i love you, man",JohnHamburg,J.K.Simmons,JonFavreau,JaneCurtin,Comedy  Romance,J.K.Simmons JonFavreau JaneCurtin JohnHamburg Comedy  Romance,
shallow hal,BobbyFarrelly,JasonAlexander,BruceMcGill,SusanWard,Comedy  Drama  Fantasy  Romance,JasonAlexander BruceMcGill SusanWard BobbyFarrelly Comedy  Drama  Fantasy  Romance,
jfk,OliverStone,SallyKirkland,JayO.Sanders,CherylPenland,Drama  History  Thriller,SallyKirkland JayO.Sanders CherylPenland OliverStone Drama  History  Thriller,
big momma's house 2,JohnWhitesell,ChloëGraceMoretz,NiaLong,MarisolNichols,Comedy  Crime,ChloëGraceMoretz NiaLong MarisolNichols JohnWhitesell Comedy  Crime,
the mexican,GoreVerbinski,J.K.Simmons,BradPitt,JuliaRoberts,Adventure  Comedy  Crime  Romance,J.K.Simmons BradPitt JuliaRoberts GoreVerbinski Adventure  Comedy  Crime  Romance,
unbroken,AngelinaJoliePitt,FinnWittrock,JackO'Connell,AlexRussell,Biography  Drama  Sport  War,FinnWittrock JackO'Connell AlexRussell AngelinaJoliePitt Biography  Drama  Sport  War,
17 again,BurrSteers,MatthewPerry,HunterParrish,ThomasLennon,Comedy  Drama  Family  Fantasy  Romance,MatthewPerry HunterParrish ThomasLennon BurrSteers Comedy  Drama  Family  Fantasy  Romance,
the other woman,NickCassavetes,DonJohnson,KateUpton,DavidThornton,Comedy  Romance,DonJohnson KateUpton DavidThornton NickCassavetes Comedy  Romance,
the final destination,DavidR.Ellis,KristaAllen,AndrewFiscella,ShantelVanSanten,Horror,KristaAllen AndrewFiscella ShantelVanSanten DavidR.Ellis Horror,
bridge of spies,StevenSpielberg,TomHanks,MarkRylance,AmyRyan,Drama  History  Thriller,TomHanks MarkRylance AmyRyan StevenSpielberg Drama  History  Thriller,
behind enemy lines,JohnMoore,JoaquimdeAlmeida,DavidKeith,SamJaeger,Action  Drama  Thriller  War,JoaquimdeAlmeida DavidKeith SamJaeger JohnMoore Action  Drama  Thriller  War,
get him to the greek,NicholasStoller,Pink,MarioLopez,LinoFacioli,Comedy  Music,Pink MarioLopez LinoFacioli NicholasStoller Comedy  Music,
shall we dance,PeterChelsom,LisaAnnWalter,NickCannon,OmarBensonMiller,Comedy  Drama  Romance,LisaAnnWalter NickCannon OmarBensonMiller PeterChelsom Comedy  Drama  Romance,
small soldiers,JoeDante,KirstenDunst,DenisLeary,RobertPicardo,Action  Adventure  Comedy  Family  Sci-Fi,KirstenDunst DenisLeary RobertPicardo JoeDante Action  Adventure  Comedy  Family  Sci-Fi,
spawn,MarkA.Z.Dippé,MichaelJaiWhite,FrankWelker,MikoHughes,Action  Horror,MichaelJaiWhite FrankWelker MikoHughes MarkA.Z.Dippé Action  Horror,
the count of monte cristo,KevinReynolds,HenryCavill,JamesFrain,MichaelWincott,Action  Adventure  Drama  Romance  Thriller,HenryCavill JamesFrain MichaelWincott KevinReynolds Action  Adventure  Drama  Romance  Thriller,
the lincoln lawyer,BradFurman,MatthewMcConaughey,MargaritaLevieva,FrancesFisher,Crime  Drama  Thriller,MatthewMcConaughey MargaritaLevieva FrancesFisher BradFurman Crime  Drama  Thriller,
the prestige,ChristopherNolan,ChristianBale,HughJackman,ScarlettJohansson,Drama  Mystery  Sci-Fi  Thriller,ChristianBale HughJackman ScarlettJohansson ChristopherNolan Drama  Mystery  Sci-Fi  Thriller,
horrible bosses 2,SeanAnders,KevinSpacey,ChristophWaltz,LindsaySloane,Comedy  Crime,KevinSpacey ChristophWaltz LindsaySloane SeanAnders Comedy  Crime,
escape from planet earth,CalBrunker,BrendanFraser,PaulScheer,JonathanMorganHeit,Adventure  Animation  Comedy  Family  Sci-Fi,BrendanFraser PaulScheer JonathanMorganHeit CalBrunker Adventure  Animation  Comedy  Family  Sci-Fi,
apocalypto,MelGibson,RudyYoungblood,DaliaHernández,JonathanBrewer,Action  Adventure  Drama  Thriller,RudyYoungblood DaliaHernández JonathanBrewer MelGibson Action  Adventure  Drama  Thriller,
the living daylights,JohnGlen,JoeDonBaker,DesmondLlewelyn,ArtMalik,Action  Adventure  Thriller,JoeDonBaker DesmondLlewelyn ArtMalik JohnGlen Action  Adventure  Thriller,
predators,NimródAntal,TopherGrace,AliceBraga,DerekMears,Action  Adventure  Sci-Fi  Thriller,TopherGrace AliceBraga DerekMears NimródAntal Action  Adventure  Sci-Fi  Thriller,
legal eagles,IvanReitman,BrianDennehy,DebraWinger,RoscoeLeeBrowne,Comedy  Crime  Romance,BrianDennehy DebraWinger RoscoeLeeBrowne IvanReitman Comedy  Crime  Romance,
secret window,DavidKoepp,JohnnyDepp,CharlesS.Dutton,TimothyHutton,Mystery  Thriller,JohnnyDepp CharlesS.Dutton TimothyHutton DavidKoepp Mystery  Thriller,
the lake house,AlejandroAgresti,KeanuReeves,DylanWalsh,EbonMoss-Bachrach,Drama  Fantasy  Romance,KeanuReeves DylanWalsh EbonMoss-Bachrach AlejandroAgresti Drama  Fantasy  Romance,
the skeleton key,IainSoftley,GenaRowlands,DeneenTyler,JoyBryant,Horror  Mystery  Thriller,GenaRowlands DeneenTyler JoyBryant IainSoftley Horror  Mystery  Thriller,
the odd life of timothy green,PeterHedges,JenniferGarner,OdeyaRush,Common,Comedy  Drama  Family  Fantasy,JenniferGarner OdeyaRush Common PeterHedges Comedy  Drama  Family  Fantasy,
made of honor,PaulWeiland,BusyPhilipps,BeauGarrett,KevinSussman,Comedy  Romance,BusyPhilipps BeauGarrett KevinSussman PaulWeiland Comedy  Romance,
jersey boys,ClintEastwood,JohnnyCannizzaro,SteveSchirripa,ScottVance,Biography  Drama  Music  Musical,JohnnyCannizzaro SteveSchirripa ScottVance ClintEastwood Biography  Drama  Music  Musical,
the rainmaker,FrancisFordCoppola,MattDamon,DeanStockwell,VirginiaMadsen,Crime  Drama  Thriller,MattDamon DeanStockwell VirginiaMadsen FrancisFordCoppola Crime  Drama  Thriller,
gothika,MathieuKassovitz,RobertDowneyJr.,CharlesS.Dutton,BernardHill,Horror  Mystery  Thriller,RobertDowneyJr. CharlesS.Dutton BernardHill MathieuKassovitz Horror  Mystery  Thriller,
amistad,StevenSpielberg,AnthonyHopkins,MorganFreeman,MatthewMcConaughey,Drama  History,AnthonyHopkins MorganFreeman MatthewMcConaughey StevenSpielberg Drama  History,
medicine man,JohnMcTiernan,LorraineBracco,JoséWilker,SeanConnery,Adventure  Drama  Romance,LorraineBracco JoséWilker SeanConnery JohnMcTiernan Adventure  Drama  Romance,
aliens vs. predator: requiem,ColinStrause,SamTrammell,JohnnyLewis,IanWhyte,Action  Horror  Sci-Fi  Thriller,SamTrammell JohnnyLewis IanWhyte ColinStrause Action  Horror  Sci-Fi  Thriller,
ri¢hie ri¢h,DonaldPetrie,MacaulayCulkin,JohnLarroquette,JonathanHyde,Comedy  Family,MacaulayCulkin JohnLarroquette JonathanHyde DonaldPetrie Comedy  Family,
autumn in new york,JoanChen,J.K.Simmons,SamTrammell,ElaineStritch,Drama  Romance,J.K.Simmons SamTrammell ElaineStritch JoanChen Drama  Romance,
music and lyrics,MarcLawrence,BradGarrett,ScottPorter,HaleyBennett,Comedy  Music  Romance,BradGarrett ScottPorter HaleyBennett MarcLawrence Comedy  Music  Romance,
paul,GregMottola,BobbyLee,NelsonAscencio,JeremyOwen,Adventure  Comedy  Sci-Fi,BobbyLee NelsonAscencio JeremyOwen GregMottola Adventure  Comedy  Sci-Fi,
the guilt trip,AnneFletcher,MiriamMargolyes,TomVirtue,JuleneRenee,Comedy  Drama,MiriamMargolyes TomVirtue JuleneRenee AnneFletcher Comedy  Drama,
scream 4,WesCraven,AlisonBrie,AimeeTeegarden,ShenaeGrimes-Beech,Horror  Mystery,AlisonBrie AimeeTeegarden ShenaeGrimes-Beech WesCraven Horror  Mystery,
8mm,JoelSchumacher,NicolasCage,ChrisBauer,AnthonyHeald,Mystery  Thriller,NicolasCage ChrisBauer AnthonyHeald JoelSchumacher Mystery  Thriller,
the doors,OliverStone,MichaelWincott,KevinDillon,KathleenQuinlan,Biography  Drama  Music  Musical,MichaelWincott KevinDillon KathleenQuinlan OliverStone Biography  Drama  Music  Musical,
sex tape,JakeKasdan,JamesWilcox,RandallPark,NatFaxon,Comedy,JamesWilcox RandallPark NatFaxon JakeKasdan Comedy,
hanging up,DianeKeaton,AdamArkin,CeliaWeston,JesseJames,Comedy  Drama,AdamArkin CeliaWeston JesseJames DianeKeaton Comedy  Drama,
final destination 5,StevenQuale,EmmaBell,JacquelineMacInnesWood,CourtneyB.Vance,Horror,EmmaBell JacquelineMacInnesWood CourtneyB.Vance StevenQuale Horror,
mickey blue eyes,KellyMakin,JeanneTripplehorn,BurtYoung,VincentPastore,Comedy  Crime  Romance,JeanneTripplehorn BurtYoung VincentPastore KellyMakin Comedy  Crime  Romance,
pay it forward,MimiLeder,KevinSpacey,HaleyJoelOsment,AngieDickinson,Drama,KevinSpacey HaleyJoelOsment AngieDickinson MimiLeder Drama,
fever pitch,BobbyFarrelly,JimmyFallon,KaDeeStrickland,IoneSkye,Comedy  Drama  Romance  Sport,JimmyFallon KaDeeStrickland IoneSkye BobbyFarrelly Comedy  Drama  Romance  Sport,
arthur            ,unknown,BruceDinsmore,MelissaAltro,DanielBrochu,Animation  Comedy  Family,BruceDinsmore MelissaAltro DanielBrochu unknown Animation  Comedy  Family,
drillbit taylor,StevenBrill,LisaAnnWalter,ShaunWeiss,MattWalsh,Comedy  Drama,LisaAnnWalter ShaunWeiss MattWalsh StevenBrill Comedy  Drama,
a million ways to die in the west,SethMacFarlane,LiamNeeson,CharlizeTheron,SethMacFarlane,Comedy  Western,LiamNeeson CharlizeTheron SethMacFarlane SethMacFarlane Comedy  Western,
the shadow,RussellMulcahy,JonathanWinters,PeterBoyle,JohnKapelos,Action  Adventure  Crime  Fantasy  Mystery  Thriller,JonathanWinters PeterBoyle JohnKapelos RussellMulcahy Action  Adventure  Crime  Fantasy  Mystery  Thriller,
extremely loud & incredibly close,StephenDaldry,TomHanks,ThomasHorn,StephenHenderson,Adventure  Drama  Mystery,TomHanks ThomasHorn StephenHenderson StephenDaldry Adventure  Drama  Mystery,
morning glory,RogerMichell,NoahBean,PattiD'Arbanville,VanessaAspillaga,Comedy  Drama  Romance,NoahBean PattiD'Arbanville VanessaAspillaga RogerMichell Comedy  Drama  Romance,
get rich or die tryin',JimSheridan,50Cent,BillDuke,MarcJohnJefferies,Biography  Crime  Drama  Music,50Cent BillDuke MarcJohnJefferies JimSheridan Biography  Crime  Drama  Music,
the art of war,ChristianDuguay,MichaelBiehn,Cary-HiroyukiTagawa,AnneArcher,Action  Adventure  Crime  Thriller,MichaelBiehn Cary-HiroyukiTagawa AnneArcher ChristianDuguay Action  Adventure  Crime  Thriller,
rent,ChrisColumbus,RosarioDawson,DavidFine,JesseL.Martin,Drama  Musical  Romance,RosarioDawson DavidFine JesseL.Martin ChrisColumbus Drama  Musical  Romance,
bless the child,ChuckRussell,RufusSewell,JimmySmits,AngelaBettis,Crime  Drama  Horror  Thriller,RufusSewell JimmySmits AngelaBettis ChuckRussell Crime  Drama  Horror  Thriller,
the out-of-towners,SamWeisman,OliverHudson,ValeriePerri,CarleaseBurke,Comedy,OliverHudson ValeriePerri CarleaseBurke SamWeisman Comedy,
the island of dr. moreau,JohnFrankenheimer,MarlonBrando,TemueraMorrison,MarcoHofschneider,Horror  Sci-Fi  Thriller,MarlonBrando TemueraMorrison MarcoHofschneider JohnFrankenheimer Horror  Sci-Fi  Thriller,
the musketeer,PeterHyams,CatherineDeneuve,JustinChambers,StephenRea,Action  Adventure  Romance,CatherineDeneuve JustinChambers StephenRea PeterHyams Action  Adventure  Romance,
the other boleyn girl,JustinChadwick,NataliePortman,ScarlettJohansson,BenedictCumberbatch,Biography  Drama  History  Romance,NataliePortman ScarlettJohansson BenedictCumberbatch JustinChadwick Biography  Drama  History  Romance,
sweet november,PatO'Connor,KeanuReeves,CharlizeTheron,FrankLangella,Drama  Romance,KeanuReeves CharlizeTheron FrankLangella PatO'Connor Drama  Romance,
the reaping,StephenHopkins,StephenRea,AndreaFrankle,WilliamRagsdale,Horror  Thriller,StephenRea AndreaFrankle WilliamRagsdale StephenHopkins Horror  Thriller,
mean streets,MartinScorsese,RobertDeNiro,DavidCarradine,DavidProval,Crime  Drama  Romance  Thriller,RobertDeNiro DavidCarradine DavidProval MartinScorsese Crime  Drama  Romance  Thriller,
renaissance man,PennyMarshall,EdBegleyJr.,CliffRobertson,LilloBrancato,Comedy  Drama,EdBegleyJr. CliffRobertson LilloBrancato PennyMarshall Comedy  Drama,
colombiana,OlivierMegaton,JordiMollà,CallumBlue,JesseBorrego,Action  Crime  Drama  Thriller,JordiMollà CallumBlue JesseBorrego OlivierMegaton Action  Crime  Drama  Thriller,
the magic sword: quest for camelot,FrederikDuChau,GaryOldman,JaleelWhite,EricIdle,Adventure  Animation  Comedy  Drama  Family  Fantasy  Musical,GaryOldman JaleelWhite EricIdle FrederikDuChau Adventure  Animation  Comedy  Drama  Family  Fantasy  Musical,
city by the sea,MichaelCaton-Jones,RobertDeNiro,JamesFranco,JohnDoman,Crime  Drama  Mystery  Thriller,RobertDeNiro JamesFranco JohnDoman MichaelCaton-Jones Crime  Drama  Mystery  Thriller,
at first sight,IrwinWinkler,MiraSorvino,NathanLane,StevenWeber,Drama  Romance,MiraSorvino NathanLane StevenWeber IrwinWinkler Drama  Romance,
torque,JosephKahn,DaneCook,JayHernandez,ChristinaMilian,Action  Comedy  Crime,DaneCook JayHernandez ChristinaMilian JosephKahn Action  Comedy  Crime,
city hall,HaroldBecker,AlPacino,MartinLandau,BridgetFonda,Drama  Thriller,AlPacino MartinLandau BridgetFonda HaroldBecker Drama  Thriller,
showgirls,PaulVerhoeven,BobbiePhillips,ElizabethBerkley,RobertDavi,Drama,BobbiePhillips ElizabethBerkley RobertDavi PaulVerhoeven Drama,
marie antoinette,SofiaCoppola,KirstenDunst,ShirleyHenderson,RipTorn,Biography  Drama  History  Romance,KirstenDunst ShirleyHenderson RipTorn SofiaCoppola Biography  Drama  History  Romance,
kiss of death,BarbetSchroeder,NicolasCage,MichaelRapaport,PhilipBakerHall,Action  Crime  Thriller,NicolasCage MichaelRapaport PhilipBakerHall BarbetSchroeder Action  Crime  Thriller,
get carter,StephenKay,SylvesterStallone,MirandaRichardson,LaurenLeeSmith,Action  Crime  Drama  Thriller,SylvesterStallone MirandaRichardson LaurenLeeSmith StephenKay Action  Crime  Drama  Thriller,
the impossible,J.A.Bayona,NaomiWatts,GeraldineChaplin,OakleePendergast,Drama  Thriller,NaomiWatts GeraldineChaplin OakleePendergast J.A.Bayona Drama  Thriller,
ishtar,ElaineMay,CarolKane,WarrenBeatty,IsabelleAdjani,Action  Adventure  Comedy  Music  Thriller,CarolKane WarrenBeatty IsabelleAdjani ElaineMay Action  Adventure  Comedy  Music  Thriller,
fantastic mr. fox,WesAnderson,BillMurray,MerylStreep,HelenMcCrory,Adventure  Animation  Comedy  Crime  Family,BillMurray MerylStreep HelenMcCrory WesAnderson Adventure  Animation  Comedy  Crime  Family,
life or something like it,StephenHerek,AngelinaJoliePitt,StockardChanning,JamesGammon,Comedy  Romance,AngelinaJoliePitt StockardChanning JamesGammon StephenHerek Comedy  Romance,
memoirs of an invisible man,JohnCarpenter,RichardEpcar,MichaelMcKean,PatriciaHeaton,Comedy  Romance  Sci-Fi  Thriller,RichardEpcar MichaelMcKean PatriciaHeaton JohnCarpenter Comedy  Romance  Sci-Fi  Thriller,
amélie,Jean-PierreJeunet,MathieuKassovitz,JamelDebbouze,IsabelleNanty,Comedy  Romance,MathieuKassovitz JamelDebbouze IsabelleNanty Jean-PierreJeunet Comedy  Romance,
new york minute,DennieGordon,Mary-KateOlsen,BobSaget,RileySmith,Comedy  Crime  Family  Romance,Mary-KateOlsen BobSaget RileySmith DennieGordon Comedy  Crime  Family  Romance,
alfie,CharlesShyer,OmarEpps,NiaLong,JaneKrakowski,Comedy  Drama  Romance,OmarEpps NiaLong JaneKrakowski CharlesShyer Comedy  Drama  Romance,
big miracle,KenKwapis,TedDanson,TimBlakeNelson,AndrewDaly,Biography  Drama  Romance,TedDanson TimBlakeNelson AndrewDaly KenKwapis Biography  Drama  Romance,
the deep end of the ocean,UluGrosbard,AlexaPenaVega,TreatWilliams,JonathanJackson,Drama,AlexaPenaVega TreatWilliams JonathanJackson UluGrosbard Drama,
feardotcom,WilliamMalone,NataschaMcElhone,JeffreyCombs,UdoKier,Crime  Horror  Thriller,NataschaMcElhone JeffreyCombs UdoKier WilliamMalone Crime  Horror  Thriller,
cirque du freak: the vampire's assistant,PaulWeitz,JoshHutcherson,SalmaHayek,PatrickFugit,Action  Adventure  Fantasy  Thriller,JoshHutcherson SalmaHayek PatrickFugit PaulWeitz Action  Adventure  Fantasy  Thriller,
duplex,DannyDeVito,JustinTheroux,AmberValletta,HarveyFierstein,Comedy,JustinTheroux AmberValletta HarveyFierstein DannyDeVito Comedy,
soul men,MalcolmD.Lee,BernieMac,SeanHayes,MikeEpps,Comedy  Drama  Music,BernieMac SeanHayes MikeEpps MalcolmD.Lee Comedy  Drama  Music,
raise the titanic,JerryJameson,M.EmmetWalsh,JasonRobards,AnneArcher,Action  Adventure  Drama  Thriller,M.EmmetWalsh JasonRobards AnneArcher JerryJameson Action  Adventure  Drama  Thriller,
universal soldier: the return,MicRodgers,MichaelJaiWhite,DanielvonBargen,XanderBerkeley,Action  Sci-Fi,MichaelJaiWhite DanielvonBargen XanderBerkeley MicRodgers Action  Sci-Fi,
pandorum,ChristianAlvart,NormanReedus,DennisQuaid,EddieRouse,Action  Horror  Mystery  Sci-Fi  Thriller,NormanReedus DennisQuaid EddieRouse ChristianAlvart Action  Horror  Mystery  Sci-Fi  Thriller,
impostor,GaryFleder,GaryDourdan,MekhiPhifer,TimGuinee,Drama  Mystery  Sci-Fi  Thriller,GaryDourdan MekhiPhifer TimGuinee GaryFleder Drama  Mystery  Sci-Fi  Thriller,
extreme ops,ChristianDuguay,RufusSewell,BridgetteWilson-Sampras,RupertGraves,Action  Adventure  Thriller,RufusSewell BridgetteWilson-Sampras RupertGraves ChristianDuguay Action  Adventure  Thriller,
just visiting,Jean-MariePoiré,BridgetteWilson-Sampras,MattRoss,JohnAylward,Comedy  Fantasy  Sci-Fi,BridgetteWilson-Sampras MattRoss JohnAylward Jean-MariePoiré Comedy  Fantasy  Sci-Fi,
sunshine,DannyBoyle,ChrisEvans,BenedictWong,TroyGarity,Adventure  Sci-Fi  Thriller,ChrisEvans BenedictWong TroyGarity DannyBoyle Adventure  Sci-Fi  Thriller,
a thousand words,BrianRobbins,JohnGatins,LouSaliba,GregCollins,Comedy  Drama,JohnGatins LouSaliba GregCollins BrianRobbins Comedy  Drama,
delgo,MarcF.Adler,EricIdle,AnneBancroft,KellyRipa,Adventure  Animation  Comedy  Fantasy  Romance,EricIdle AnneBancroft KellyRipa MarcF.Adler Adventure  Animation  Comedy  Fantasy  Romance,
the gunman,PierreMorel,RayWinstone,MarkRylance,JasmineTrinca,Action  Crime  Drama  Mystery  Thriller,RayWinstone MarkRylance JasmineTrinca PierreMorel Action  Crime  Drama  Mystery  Thriller,
alex rider: operation stormbreaker,GeoffreySax,AlexPettyfer,SophieOkonedo,AshleyWalters,Action  Adventure  Family  Thriller,AlexPettyfer SophieOkonedo AshleyWalters GeoffreySax Action  Adventure  Family  Thriller,
hackers,IainSoftley,AngelinaJoliePitt,FisherStevens,LorraineBracco,Comedy  Crime  Drama  Thriller,AngelinaJoliePitt FisherStevens LorraineBracco IainSoftley Comedy  Crime  Drama  Thriller,
the hunting party,RichardShepard,JamesBrolin,ZanMarolt,LjubomirKerekes,Adventure  Comedy  Drama  Romance  Thriller  War,JamesBrolin ZanMarolt LjubomirKerekes RichardShepard Adventure  Comedy  Drama  Romance  Thriller  War,
the hudsucker proxy,JoelCoen,JenniferJasonLeigh,BillCobbs,JohnMahoney,Comedy  Fantasy,JenniferJasonLeigh BillCobbs JohnMahoney JoelCoen Comedy  Fantasy,
the warlords,PeterHo-SunChan,JetLi,TakeshiKaneshiro,AndyLau,Action  Drama  History  Romance  War,JetLi TakeshiKaneshiro AndyLau PeterHo-SunChan Action  Drama  History  Romance  War,
nomad: the warrior,SergeyBodrov,JayHernandez,KunoBecker,JasonScottLee,Drama  History  War,JayHernandez KunoBecker JasonScottLee SergeyBodrov Drama  History  War,
snowpiercer,Joon-hoBong,ChrisEvans,EwenBremner,Kang-hoSong,Action  Drama  Sci-Fi  Thriller,ChrisEvans EwenBremner Kang-hoSong Joon-hoBong Action  Drama  Sci-Fi  Thriller,
a monster in paris,BiboBergeron,AdamGoldberg,BobBalaban,FrançoisCluzet,Adventure  Animation  Comedy  Fantasy  Music  Romance,AdamGoldberg BobBalaban FrançoisCluzet BiboBergeron Adventure  Animation  Comedy  Fantasy  Music  Romance,
the last shot,JeffNathanson,MatthewBroderick,GlennMorshower,TimBlakeNelson,Comedy,MatthewBroderick GlennMorshower TimBlakeNelson JeffNathanson Comedy,
the crow,AlexProyas,MichaelWincott,BaiLing,DavidPatrickKelly,Action  Drama  Fantasy,MichaelWincott BaiLing DavidPatrickKelly AlexProyas Action  Drama  Fantasy,
baahubali: the beginning,S.S.Rajamouli,TamannaahBhatia,AnushkaShetty,Prabhas,Action  Adventure  Drama  Fantasy  War,TamannaahBhatia AnushkaShetty Prabhas S.S.Rajamouli Action  Adventure  Drama  Fantasy  War,
the time traveler's wife,RobertSchwentke,ArlissHoward,BrooklynnProulx,MichelleNolden,Drama  Fantasy  Romance  Sci-Fi,ArlissHoward BrooklynnProulx MichelleNolden RobertSchwentke Drama  Fantasy  Romance  Sci-Fi,
because i said so,MichaelLehmann,ColinFerguson,StephenCollins,TomEverettScott,Comedy  Romance,ColinFerguson StephenCollins TomEverettScott MichaelLehmann Comedy  Romance,
the fast and the furious,RobCohen,PaulWalker,VinDiesel,JordanaBrewster,Action  Crime  Thriller,PaulWalker VinDiesel JordanaBrewster RobCohen Action  Crime  Thriller,
frankenweenie,TimBurton,MartinLandau,CatherineO'Hara,AtticusShaffer,Animation  Comedy  Family  Horror  Sci-Fi,MartinLandau CatherineO'Hara AtticusShaffer TimBurton Animation  Comedy  Family  Horror  Sci-Fi,
serenity,JossWhedon,AdamBaldwin,SeanMaher,MichaelHitchcock,Action  Adventure  Sci-Fi  Thriller,AdamBaldwin SeanMaher MichaelHitchcock JossWhedon Action  Adventure  Sci-Fi  Thriller,
against the ropes,CharlesS.Dutton,OmarEpps,CharlesS.Dutton,TimDaly,Biography  Drama  Romance  Sport,OmarEpps CharlesS.Dutton TimDaly CharlesS.Dutton Biography  Drama  Romance  Sport,
superman iii,RichardLester,MargotKidder,RobertVaughn,JackieCooper,Action  Comedy  Sci-Fi,MargotKidder RobertVaughn JackieCooper RichardLester Action  Comedy  Sci-Fi,
grudge match,PeterSegal,RobertDeNiro,SylvesterStallone,OscarGale,Comedy  Sport,RobertDeNiro SylvesterStallone OscarGale PeterSegal Comedy  Sport,
red cliff,JohnWoo,TakeshiKaneshiro,TonyChiuWaiLeung,WeiZhao,Action  Adventure  Drama  History  War,TakeshiKaneshiro TonyChiuWaiLeung WeiZhao JohnWoo Action  Adventure  Drama  History  War,
sweet home alabama,AndyTennant,EthanEmbry,MaryLynnRajskub,CourtneyGains,Comedy  Romance,EthanEmbry MaryLynnRajskub CourtneyGains AndyTennant Comedy  Romance,
the ugly truth,RobertLuketic,GerardButler,JohnMichaelHiggins,EricWinter,Comedy  Romance,GerardButler JohnMichaelHiggins EricWinter RobertLuketic Comedy  Romance,
sgt. bilko,JonathanLynn,AustinPendleton,PhilHartman,MaxCasella,Comedy,AustinPendleton PhilHartman MaxCasella JonathanLynn Comedy,
spy kids 2: island of lost dreams,RobertRodriguez,SteveBuscemi,AlexaPenaVega,EmilyOsment,Action  Adventure  Comedy  Family  Sci-Fi,SteveBuscemi AlexaPenaVega EmilyOsment RobertRodriguez Action  Adventure  Comedy  Family  Sci-Fi,
star trek: generations,DavidCarson,LeVarBurton,AlanRuck,JonathanFrakes,Action  Adventure  Mystery  Sci-Fi  Thriller,LeVarBurton AlanRuck JonathanFrakes DavidCarson Action  Adventure  Mystery  Sci-Fi  Thriller,
the grandmaster,Kar-WaiWong,TonyChiuWaiLeung,Hye-kyoSong,ElvisTsui,Action  Biography  Drama,TonyChiuWaiLeung Hye-kyoSong ElvisTsui Kar-WaiWong Action  Biography  Drama,
water for elephants,FrancisLawrence,RobertPattinson,ChristophWaltz,JamesFrain,Drama  Romance,RobertPattinson ChristophWaltz JamesFrain FrancisLawrence Drama  Romance,
3rd rock from the sun            ,unknown,JosephGordon-Levitt,WayneKnight,KristenJohnston,Comedy  Family  Sci-Fi,JosephGordon-Levitt WayneKnight KristenJohnston unknown Comedy  Family  Sci-Fi,
dragon nest: warriors' dawn,YuefengSong,BlytheAuffarth,BiancaCollins,JiaoXu,Adventure  Animation  Family  Fantasy,BlytheAuffarth BiancaCollins JiaoXu YuefengSong Adventure  Animation  Family  Fantasy,
the hurricane,NormanJewison,DenzelWashington,VincentPastore,DeborahKaraUnger,Biography  Drama  Sport,DenzelWashington VincentPastore DeborahKaraUnger NormanJewison Biography  Drama  Sport,
enough,MichaelApted,BillCobbs,JeffKober,BillyCampbell,Crime  Drama  Thriller,BillCobbs JeffKober BillyCampbell MichaelApted Crime  Drama  Thriller,
heartbreakers,DavidMirkin,SarahSilverman,AnneBancroft,JeffreyJones,Comedy  Crime  Romance,SarahSilverman AnneBancroft JeffreyJones DavidMirkin Comedy  Crime  Romance,
paul blart: mall cop 2,AndyFickman,D.B.Woodside,DaniellaAlonso,EduardoVerástegui,Action  Comedy  Crime,D.B.Woodside DaniellaAlonso EduardoVerástegui AndyFickman Action  Comedy  Crime,
angel eyes,LuisMandoki,SoniaBraga,ShirleyKnight,KariMatchett,Drama  Romance,SoniaBraga ShirleyKnight KariMatchett LuisMandoki Drama  Romance,
joe somebody,JohnPasquin,JimBelushi,KenMarino,KellyLynch,Comedy  Drama,JimBelushi KenMarino KellyLynch JohnPasquin Comedy  Drama,
the ninth gate,RomanPolanski,JohnnyDepp,FrankLangella,LenaOlin,Mystery  Thriller,JohnnyDepp FrankLangella LenaOlin RomanPolanski Mystery  Thriller,
extreme measures,MichaelApted,J.K.Simmons,PaulGuilfoyle,BillNunn,Crime  Drama  Mystery  Thriller,J.K.Simmons PaulGuilfoyle BillNunn MichaelApted Crime  Drama  Mystery  Thriller,
rock star,StephenHerek,BethGrant,DagmaraDominczyk,MatthewGlave,Drama  Music,BethGrant DagmaraDominczyk MatthewGlave StephenHerek Drama  Music,
white squall,RidleyScott,JeffBridges,JasonMarsden,EthanEmbry,Adventure  Drama,JeffBridges JasonMarsden EthanEmbry RidleyScott Adventure  Drama,
the thing,JohnCarpenter,WilfordBrimley,RichardMasur,DavidClennon,Horror  Mystery  Sci-Fi,WilfordBrimley RichardMasur DavidClennon JohnCarpenter Horror  Mystery  Sci-Fi,
riddick,DavidTwohy,VinDiesel,NolanGerardFunk,BokeemWoodbine,Action  Sci-Fi  Thriller,VinDiesel NolanGerardFunk BokeemWoodbine DavidTwohy Action  Sci-Fi  Thriller,
switchback,JebStuart,GregoryScottCummins,ClaudiaStedelin,TedMarkland,Crime  Mystery  Thriller,GregoryScottCummins ClaudiaStedelin TedMarkland JebStuart Crime  Mystery  Thriller,
texas rangers,SteveMiner,TomSkerritt,UsherRaymond,LeonorVarela,Action  Adventure  Drama  Thriller  Western,TomSkerritt UsherRaymond LeonorVarela SteveMiner Action  Adventure  Drama  Thriller  Western,
