movie_title,director_name,actor_1_name,actor_2_name,actor_3_name,genres,comb,id
end of watch,DavidAyer,JakeGyllenhaal,AnnaKendrick,AmericaFerrera,Crime  Drama  Thriller,JakeGyllenhaal AnnaKendrick AmericaFerrera DavidAyer Crime  Drama  Thriller,
aloha,CameronCrowe,EmmaStone,BradleyCooper,BillMurray,Comedy  Drama  Romance,EmmaStone BradleyCooper BillMurray CameronCrowe Comedy  Drama  Romance,
the skulls,RobCohen,PaulWalker,LeslieBibb,WilliamPetersen,Action  Crime  Drama  Thriller,PaulWalker LeslieBibb WilliamPetersen RobCohen Action  Crime  Drama  Thriller,
the theory of everything,JamesMarsh,EddieRedmayne,EmilyWatson,SimonMcBurney,Biography  Drama  Romance,EddieRedmayne EmilyWatson SimonMcBurney JamesMarsh Biography  Drama  Romance,
malibu's most wanted,JohnWhitesell,GregGrunberg,ReginaHall,BlairUnderwood,Comedy  Crime,GregGrunberg ReginaHall BlairUnderwood JohnWhitesell Comedy  Crime,
where the heart is,MattWilliams,NataliePortman,JamesFrain,StockardChanning,Comedy  Drama  Romance,NataliePortman JamesFrain StockardChanning MattWilliams Comedy  Drama  Romance,
lawrence of arabia,DavidLean,ClaudeRains,JoséFerrer,JackHawkins,Adventure  Biography  Drama  History  War,ClaudeRains JoséFerrer JackHawkins DavidLean Adventure  Biography  Drama  History  War,
wild,Jean-MarcVallée,MichielHuisman,KevinRankin,GabyHoffmann,Adventure  Biography  Drama,MichielHuisman KevinRankin GabyHoffmann Jean-MarcVallée Adventure  Biography  Drama,
the wedding date,ClareKilner,JackDavenport,DebraMessing,HollandTaylor,Comedy  Romance,JackDavenport DebraMessing HollandTaylor ClareKilner Comedy  Romance,
halloween: resurrection,RickRosenthal,JamieLeeCurtis,ThomasIanNicholas,BiancaKajlich,Comedy  Horror  Thriller,JamieLeeCurtis ThomasIanNicholas BiancaKajlich RickRosenthal Comedy  Horror  Thriller,
clash of the titans,LouisLeterrier,LiamNeeson,JasonFlemyng,AlexaDavalos,Action  Adventure  Fantasy,LiamNeeson JasonFlemyng AlexaDavalos LouisLeterrier Action  Adventure  Fantasy,
the princess bride,RobReiner,RobinWright,CarolKane,AndrétheGiant,Adventure  Family  Fantasy  Romance,RobinWright CarolKane AndrétheGiant RobReiner Adventure  Family  Fantasy  Romance,
the great debaters,DenzelWashington,DenzelWashington,JurneeSmollett-Bell,JohnHeard,Biography  Drama,DenzelWashington JurneeSmollett-Bell JohnHeard DenzelWashington Biography  Drama,
drive,NicolasWindingRefn,RyanGosling,AlbertBrooks,RussTamblyn,Crime  Drama,RyanGosling AlbertBrooks RussTamblyn NicolasWindingRefn Crime  Drama,
confessions of a teenage drama queen,SaraSugarman,AdamGarcia,CarolKane,GlenneHeadly,Comedy  Family  Music  Romance,AdamGarcia CarolKane GlenneHeadly SaraSugarman Comedy  Family  Music  Romance,
the object of my affection,NicholasHytner,LiamAiken,TimDaly,KaliRocha,Comedy  Drama  Romance,LiamAiken TimDaly KaliRocha NicholasHytner Comedy  Drama  Romance,
28 weeks later,JuanCarlosFresnadillo,JeremyRenner,HaroldPerrineau,CatherineMcCormack,Drama  Horror  Sci-Fi,JeremyRenner HaroldPerrineau CatherineMcCormack JuanCarlosFresnadillo Drama  Horror  Sci-Fi,
when the game stands tall,ThomasCarter,JessieT.Usher,MatthewDaddario,Ser'DariusBlain,Drama  Family  Sport,JessieT.Usher MatthewDaddario Ser'DariusBlain ThomasCarter Drama  Family  Sport,
because of winn-dixie,WayneWang,CicelyTyson,LukeBenward,EvaMarieSaint,Comedy  Drama  Family,CicelyTyson LukeBenward EvaMarieSaint WayneWang Comedy  Drama  Family,
love & basketball,GinaPrince-Bythewood,AlfreWoodard,SanaaLathan,OmarEpps,Drama  Romance  Sport,AlfreWoodard SanaaLathan OmarEpps GinaPrince-Bythewood Drama  Romance  Sport,
grosse pointe blank,GeorgeArmitage,MinnieDriver,MichaelCudlitz,MitchellRyan,Action  Comedy  Crime  Romance  Thriller,MinnieDriver MichaelCudlitz MitchellRyan GeorgeArmitage Action  Comedy  Crime  Romance  Thriller,
all about steve,PhilTraill,BradleyCooper,KatyMixon,BethGrant,Comedy  Romance,BradleyCooper KatyMixon BethGrant PhilTraill Comedy  Romance,
book of shadows: blair witch 2,JoeBerlinger,KimDirector,EricaLeerhsen,KurtLoder,Adventure  Fantasy  Horror  Mystery  Thriller,KimDirector EricaLeerhsen KurtLoder JoeBerlinger Adventure  Fantasy  Horror  Mystery  Thriller,
the craft,AndrewFleming,ChristineTaylor,RachelTrue,BrendaStrong,Drama  Fantasy  Horror  Thriller,ChristineTaylor RachelTrue BrendaStrong AndrewFleming Drama  Fantasy  Horror  Thriller,
match point,WoodyAllen,ScarlettJohansson,MarkGatiss,PenelopeWilton,Drama  Romance  Thriller,ScarlettJohansson MarkGatiss PenelopeWilton WoodyAllen Drama  Romance  Thriller,
ramona and beezus,ElizabethAllenRosenbaum,SierraMcCormick,HutchDano,JasonSpevack,Adventure  Comedy  Family  Fantasy,SierraMcCormick HutchDano JasonSpevack ElizabethAllenRosenbaum Adventure  Comedy  Family  Fantasy,
the remains of the day,JamesIvory,AnthonyHopkins,PeterVaughan,BenChaplin,Drama  Romance,AnthonyHopkins PeterVaughan BenChaplin JamesIvory Drama  Romance,
boogie nights,PaulThomasAnderson,DonCheadle,NicoleAriParker,NinaHartley,Drama,DonCheadle NicoleAriParker NinaHartley PaulThomasAnderson Drama,
nowhere to run,RobertHarmon,KieranCulkin,RosannaArquette,JossAckland,Action  Crime  Drama  Romance  Thriller,KieranCulkin RosannaArquette JossAckland RobertHarmon Action  Crime  Drama  Romance  Thriller,
flicka,MichaelMayer,AlisonLohman,DannyPino,TimMcGraw,Adventure  Drama  Family,AlisonLohman DannyPino TimMcGraw MichaelMayer Adventure  Drama  Family,
the hills have eyes ii,MartinWeisz,JeffKober,DaniellaAlonso,JacobVargas,Horror,JeffKober DaniellaAlonso JacobVargas MartinWeisz Horror,
urban legends: final cut,JohnOttman,LorettaDevine,JoeyLawrence,JacindaBarrett,Horror  Mystery  Thriller,LorettaDevine JoeyLawrence JacindaBarrett JohnOttman Horror  Mystery  Thriller,
tuck everlasting,JayRussell,WilliamHurt,SissySpacek,JonathanJackson,Drama  Family  Fantasy  Romance,WilliamHurt SissySpacek JonathanJackson JayRussell Drama  Family  Fantasy  Romance,
the marine,JohnBonito,KellyCarlson,FirassDirani,DrewPowell,Action  Drama  Thriller,KellyCarlson FirassDirani DrewPowell JohnBonito Action  Drama  Thriller,
keanu,PeterAtencio,NiaLong,WillForte,Keegan-MichaelKey,Action  Comedy,NiaLong WillForte Keegan-MichaelKey PeterAtencio Action  Comedy,
country strong,ShanaFeste,LeightonMeester,CindaMcCain,TimMcGraw,Drama  Music,LeightonMeester CindaMcCain TimMcGraw ShanaFeste Drama  Music,
disturbing behavior,DavidNutter,BruceGreenwood,EthanEmbry,KatharineIsabelle,Horror  Mystery  Sci-Fi  Thriller,BruceGreenwood EthanEmbry KatharineIsabelle DavidNutter Horror  Mystery  Sci-Fi  Thriller,
the place beyond the pines,DerekCianfrance,RyanGosling,BenMendelsohn,AngeloAnthonyPizza,Crime  Drama  Thriller,RyanGosling BenMendelsohn AngeloAnthonyPizza DerekCianfrance Crime  Drama  Thriller,
the november man,RogerDonaldson,LukeBracey,AkieKotabe,WillPatton,Action  Crime  Thriller,LukeBracey AkieKotabe WillPatton RogerDonaldson Action  Crime  Thriller,
eye of the beholder,StephanElliott,JasonPriestley,PatrickBergin,GenevièveBujold,Drama  Mystery  Thriller,JasonPriestley PatrickBergin GenevièveBujold StephanElliott Drama  Mystery  Thriller,
the hurt locker,KathrynBigelow,JeremyRenner,ChristianCamargo,BrianGeraghty,Drama  History  Thriller  War,JeremyRenner ChristianCamargo BrianGeraghty KathrynBigelow Drama  History  Thriller  War,
firestarter,MarkL.Lester,HeatherLocklear,GeorgeC.Scott,DavidKeith,Action  Horror  Sci-Fi  Thriller,HeatherLocklear GeorgeC.Scott DavidKeith MarkL.Lester Action  Horror  Sci-Fi  Thriller,
killing them softly,AndrewDominik,BradPitt,SamShepard,BenMendelsohn,Crime  Thriller,BradPitt SamShepard BenMendelsohn AndrewDominik Crime  Thriller,
a most wanted man,AntonCorbijn,PhilipSeymourHoffman,NinaHoss,HomayounErshadi,Crime  Drama  Thriller,PhilipSeymourHoffman NinaHoss HomayounErshadi AntonCorbijn Crime  Drama  Thriller,
freddy got fingered,TomGreen,RipTorn,HarlandWilliams,EddieKayeThomas,Comedy,RipTorn HarlandWilliams EddieKayeThomas TomGreen Comedy,
the pirates who don't do anything: a veggietales movie,MikeNawrocki,YuriLowenthal,CamClarke,PhilVischer,Adventure  Animation  Comedy  Family,YuriLowenthal CamClarke PhilVischer MikeNawrocki Adventure  Animation  Comedy  Family,
u2 3d,CatherineOwens,Bono,TheEdge,LarryMullenJr.,Documentary  Music,Bono TheEdge LarryMullenJr. CatherineOwens Documentary  Music,
highlander: endgame,DouglasAarniokoski,ChristopherLambert,AdrianPaul,AdamCopeland,Action  Adventure  Fantasy  Sci-Fi,ChristopherLambert AdrianPaul AdamCopeland DouglasAarniokoski Action  Adventure  Fantasy  Sci-Fi,
idlewild,BryanBarber,CicelyTyson,FaizonLove,Bobb'eJ.Thompson,Crime  Drama  Musical  Romance,CicelyTyson FaizonLove Bobb'eJ.Thompson BryanBarber Crime  Drama  Musical  Romance,
one day,LoneScherfig,AnneHathaway,JimSturgess,RafeSpall,Drama  Romance,AnneHathaway JimSturgess RafeSpall LoneScherfig Drama  Romance,
whip it,DrewBarrymore,DanielStern,JimmyFallon,AliaShawkat,Drama  Sport,DanielStern JimmyFallon AliaShawkat DrewBarrymore Drama  Sport,
knockaround guys,BrianKoppelman,VinDiesel,TomNoonan,KevinGage,Crime  Drama  Thriller,VinDiesel TomNoonan KevinGage BrianKoppelman Crime  Drama  Thriller,
confidence,JamesFoley,LouisLombardi,BrianVanHolt,LelandOrser,Crime  Thriller,LouisLombardi BrianVanHolt LelandOrser JamesFoley Crime  Thriller,
the muse,AlbertBrooks,JeffBridges,BradleyWhitford,AlbertBrooks,Comedy,JeffBridges BradleyWhitford AlbertBrooks AlbertBrooks Comedy,
de-lovely,IrwinWinkler,KevinMcNally,KeithAllen,SandraNelson,Biography  Drama  Music  Musical,KevinMcNally KeithAllen SandraNelson IrwinWinkler Biography  Drama  Music  Musical,
new york stories,WoodyAllen,WoodyAllen,LarryDavid,MiaFarrow,Comedy  Drama  Romance,WoodyAllen LarryDavid MiaFarrow WoodyAllen Comedy  Drama  Romance,
barney's great adventure,SteveGomer,TrevorMorgan,KylaPratt,ShirleyDouglas,Adventure  Family,TrevorMorgan KylaPratt ShirleyDouglas SteveGomer Adventure  Family,
the man with the iron fists,RZA,RickYune,RZA,DanielWu,Action,RickYune RZA DanielWu RZA Action,
home fries,DeanParisot,CatherineO'Hara,JakeBusey,ShelleyDuvall,Comedy  Drama  Romance,CatherineO'Hara JakeBusey ShelleyDuvall DeanParisot Comedy  Drama  Romance,
here on earth,MarkPiznarski,BruceGreenwood,ChrisKlein,ElaineHendrix,Drama  Romance,BruceGreenwood ChrisKlein ElaineHendrix MarkPiznarski Drama  Romance,
brazil,TerryGilliam,RobertDeNiro,BobHoskins,JimBroadbent,Drama  Sci-Fi,RobertDeNiro BobHoskins JimBroadbent TerryGilliam Drama  Sci-Fi,
raise your voice,SeanMcNamara,OliverJames,RebeccaDeMornay,JasonRitter,Family  Music  Romance,OliverJames RebeccaDeMornay JasonRitter SeanMcNamara Family  Music  Romance,
the dead zone            ,unknown,DavidOgdenStiers,NicoledeBoer,ChrisBruno,Drama  Fantasy  Mystery  Sci-Fi,DavidOgdenStiers NicoledeBoer ChrisBruno unknown Drama  Fantasy  Mystery  Sci-Fi,
the big lebowski,JoelCoen,PhilipSeymourHoffman,JeffBridges,SteveBuscemi,Comedy  Crime,PhilipSeymourHoffman JeffBridges SteveBuscemi JoelCoen Comedy  Crime,
black snake moan,CraigBrewer,JustinTimberlake,MichaelRaymond-James,S.EpathaMerkerson,Drama  Music,JustinTimberlake MichaelRaymond-James S.EpathaMerkerson CraigBrewer Drama  Music,
dark blue,RonShelton,KhandiAlexander,DashMihok,MichaelMichele,Crime  Drama  Romance  Thriller,KhandiAlexander DashMihok MichaelMichele RonShelton Crime  Drama  Romance  Thriller,
a mighty heart,MichaelWinterbottom,AngelinaJoliePitt,ArchiePanjabi,DanFutterman,Biography  Drama  History  Thriller  War,AngelinaJoliePitt ArchiePanjabi DanFutterman MichaelWinterbottom Biography  Drama  History  Thriller  War,
whatever it takes,DavidRaynr,JamesFranco,JodiLynO'Keefe,MarlaSokoloff,Comedy  Drama  Romance,JamesFranco JodiLynO'Keefe MarlaSokoloff DavidRaynr Comedy  Drama  Romance,
boat trip,MortNathan,VivicaA.Fox,LinShaye,BobGunton,Comedy,VivicaA.Fox LinShaye BobGunton MortNathan Comedy,
the importance of being earnest,OliverParker,ColinFirth,TomWilkinson,RupertEverett,Comedy  Drama  Romance,ColinFirth TomWilkinson RupertEverett OliverParker Comedy  Drama  Romance,
hoot,WilShriner,LoganLerman,NeilFlynn,TimBlakeNelson,Adventure  Comedy  Family,LoganLerman NeilFlynn TimBlakeNelson WilShriner Adventure  Comedy  Family,
in bruges,MartinMcDonagh,ElizabethBerrington,AnnaMadeley,EricGodon,Comedy  Crime  Drama,ElizabethBerrington AnnaMadeley EricGodon MartinMcDonagh Comedy  Crime  Drama,
peeples,TinaGordonChism,TylerJamesWilliams,S.EpathaMerkerson,DiahannCarroll,Comedy  Romance,TylerJamesWilliams S.EpathaMerkerson DiahannCarroll TinaGordonChism Comedy  Romance,
the rocker,PeterCattaneo,EmmaStone,BradleyCooper,JoshGad,Comedy  Music,EmmaStone BradleyCooper JoshGad PeterCattaneo Comedy  Music,
post grad,VickyJenson,J.K.Simmons,ZachGilford,BobbyColeman,Comedy  Romance,J.K.Simmons ZachGilford BobbyColeman VickyJenson Comedy  Romance,
promised land,GusVanSant,MattDamon,HalHolbrook,TerryKinney,Drama,MattDamon HalHolbrook TerryKinney GusVanSant Drama,
whatever works,WoodyAllen,LarryDavid,MichaelMcKean,ConlethHill,Comedy  Romance,LarryDavid MichaelMcKean ConlethHill WoodyAllen Comedy  Romance,
the in crowd,MaryLambert,MatthewSettle,SusanWard,A.J.Buckley,Drama  Mystery  Thriller,MatthewSettle SusanWard A.J.Buckley MaryLambert Drama  Mystery  Thriller,
three burials,TommyLeeJones,LevonHelm,DwightYoakam,GuillermoArriaga,Adventure  Crime  Drama  Mystery  Western,LevonHelm DwightYoakam GuillermoArriaga TommyLeeJones Adventure  Crime  Drama  Mystery  Western,
jakob the liar,PeterKassovitz,RobinWilliams,MarkMargolis,MichaelJeter,Drama  War,RobinWilliams MarkMargolis MichaelJeter PeterKassovitz Drama  War,
kiss kiss bang bang,ShaneBlack,RobertDowneyJr.,CorbinBernsen,LarryMiller,Comedy  Crime  Mystery,RobertDowneyJr. CorbinBernsen LarryMiller ShaneBlack Comedy  Crime  Mystery,
idle hands,RodmanFlender,VivicaA.Fox,FredWillard,EldenHenson,Comedy  Fantasy  Horror  Thriller,VivicaA.Fox FredWillard EldenHenson RodmanFlender Comedy  Fantasy  Horror  Thriller,
mulholland drive,DavidLynch,NaomiWatts,RobertForster,LauraHarring,Drama  Mystery  Thriller,NaomiWatts RobertForster LauraHarring DavidLynch Drama  Mystery  Thriller,
blood and chocolate,KatjavonGarnier,OlivierMartinez,AgnesBruckner,ChrisGeere,Drama  Fantasy  Horror  Romance,OlivierMartinez AgnesBruckner ChrisGeere KatjavonGarnier Drama  Fantasy  Horror  Romance,
you will meet a tall dark stranger,WoodyAllen,AnthonyHopkins,NaomiWatts,EwenBremner,Comedy  Drama  Romance,AnthonyHopkins NaomiWatts EwenBremner WoodyAllen Comedy  Drama  Romance,
never let me go,MarkRomanek,AndrewGarfield,CharlieRowe,CharlotteRampling,Drama  Romance  Sci-Fi,AndrewGarfield CharlieRowe CharlotteRampling MarkRomanek Drama  Romance  Sci-Fi,
the company            ,unknown,AnnaSilk,TomHollander,AlessandroNivola,Drama  History  Thriller,AnnaSilk TomHollander AlessandroNivola unknown Drama  History  Thriller,
transsiberian,BradAnderson,ThomasKretschmann,EduardoNoriega,MacMcDonald,Crime  Drama  Mystery  Thriller,ThomasKretschmann EduardoNoriega MacMcDonald BradAnderson Crime  Drama  Mystery  Thriller,
the clan of the cave bear,MichaelChapman,CurtisArmstrong,PamelaReed,MikeMuscat,Adventure  Drama  Fantasy,CurtisArmstrong PamelaReed MikeMuscat MichaelChapman Adventure  Drama  Fantasy,
crazy in alabama,AntonioBanderas,MeatLoaf,ElizabethPerkins,NoahEmmerich,Comedy  Crime  Drama,MeatLoaf ElizabethPerkins NoahEmmerich AntonioBanderas Comedy  Crime  Drama,
funny games,MichaelHaneke,NaomiWatts,SiobhanFallonHogan,BradyCorbet,Crime  Drama  Horror  Thriller,NaomiWatts SiobhanFallonHogan BradyCorbet MichaelHaneke Crime  Drama  Horror  Thriller,
listening,KhalilSullins,ThomasStroppel,KalimChandler,AmberMarieBollinger,Drama  Sci-Fi  Thriller,ThomasStroppel KalimChandler AmberMarieBollinger KhalilSullins Drama  Sci-Fi  Thriller,
felicia's journey,AtomEgoyan,BobHoskins,ElaineCassidy,GerardMcSorley,Drama  Thriller,BobHoskins ElaineCassidy GerardMcSorley AtomEgoyan Drama  Thriller,
metropolis,FritzLang,BrigitteHelm,GustavFröhlich,RudolfKlein-Rogge,Drama  Sci-Fi,BrigitteHelm GustavFröhlich RudolfKlein-Rogge FritzLang Drama  Sci-Fi,
district b13,PierreMorel,DavidBelle,CyrilRaffaelli,DanyVerissimo-Petit,Action  Crime  Thriller,DavidBelle CyrilRaffaelli DanyVerissimo-Petit PierreMorel Action  Crime  Thriller,
things to do in denver when you're dead,GaryFleder,SteveBuscemi,BillCobbs,TreatWilliams,Crime  Drama,SteveBuscemi BillCobbs TreatWilliams GaryFleder Crime  Drama,
the assassin,Hsiao-HsienHou,QiShu,ChenChang,SatoshiTsumabuki,Action  Drama,QiShu ChenChang SatoshiTsumabuki Hsiao-HsienHou Action  Drama,
buffalo soldiers,GregorJordan,DeanStockwell,ScottGlenn,Leon,Comedy  Crime  Drama  Thriller  War,DeanStockwell ScottGlenn Leon GregorJordan Comedy  Crime  Drama  Thriller  War,
the return,AndreyZvyagintsev,KonstantinLavronenko,VladimirGarin,NataliyaVdovina,Drama  Mystery  Thriller,KonstantinLavronenko VladimirGarin NataliyaVdovina AndreyZvyagintsev Drama  Mystery  Thriller,
ong-bak 2,TonyJaa,NirutSirichanya,PetchtaiWongkamlao,SarunyuWongkrachang,Action,NirutSirichanya PetchtaiWongkamlao SarunyuWongkrachang TonyJaa Action,
centurion,NeilMarshall,MichaelFassbender,JJFeild,DaveLegeno,Action  Adventure  Drama  History  Thriller  War,MichaelFassbender JJFeild DaveLegeno NeilMarshall Action  Adventure  Drama  History  Thriller  War,
silent trigger,RussellMulcahy,ChristopherHeyerdahl,GinaBellman,ConradDunn,Action  Drama  Thriller,ChristopherHeyerdahl GinaBellman ConradDunn RussellMulcahy Action  Drama  Thriller,
the midnight meat train,RyûheiKitamura,BradleyCooper,BrookeShields,LeslieBibb,Fantasy  Horror  Mystery,BradleyCooper BrookeShields LeslieBibb RyûheiKitamura Fantasy  Horror  Mystery,
winnie mandela,DarrellRoodt,JenniferHudson,WendyCrewson,AubreyPoo,Biography  Drama  History,JenniferHudson WendyCrewson AubreyPoo DarrellRoodt Biography  Drama  History,
the son of no one,DitoMontiel,ChanningTatum,AlPacino,TracyMorgan,Crime  Drama  Thriller,ChanningTatum AlPacino TracyMorgan DitoMontiel Crime  Drama  Thriller,
all the queen's men,StefanRuzowitzky,EddieIzzard,UdoKier,EdwardFox,Action  Comedy  Drama  War,EddieIzzard UdoKier EdwardFox StefanRuzowitzky Action  Comedy  Drama  War,
the good night,JakePaltrow,StephenGraham,GaelLeCornec,KeithAllen,Comedy  Drama  Fantasy  Music  Romance,StephenGraham GaelLeCornec KeithAllen JakePaltrow Comedy  Drama  Fantasy  Music  Romance,
bathory: countess of blood,JurajJakubisko,AnnaFriel,HansMatheson,FrancoNero,Biography  Drama  Fantasy  History,AnnaFriel HansMatheson FrancoNero JurajJakubisko Biography  Drama  Fantasy  History,
khumba,AnthonySilverston,LiamNeeson,SteveBuscemi,LorettaDevine,Adventure  Animation  Family,LiamNeeson SteveBuscemi LorettaDevine AnthonySilverston Adventure  Animation  Family,
automata,GabeIbáñez,BirgitteHjortSørensen,RobertForster,MelanieGriffith,Action  Sci-Fi  Thriller,BirgitteHjortSørensen RobertForster MelanieGriffith GabeIbáñez Action  Sci-Fi  Thriller,
dungeons & dragons: wrath of the dragon god,GerryLively,BrucePayne,LucyGaskell,StevenElder,Action  Adventure  Fantasy,BrucePayne LucyGaskell StevenElder GerryLively Action  Adventure  Fantasy,
chiamatemi francesco - il papa della gente,DanieleLuchetti,MaximilianDirr,RodrigoDelaSerna,FerdinandoVetere,Biography,MaximilianDirr RodrigoDelaSerna FerdinandoVetere DanieleLuchetti Biography,
shinjuku incident,Tung-ShingYee,BingbingFan,DanielWu,YasuakiKurata,Action  Crime  Drama  Thriller,BingbingFan DanielWu YasuakiKurata Tung-ShingYee Action  Crime  Drama  Thriller,
pandaemonium,JulienTemple,SamanthaMorton,DexterFletcher,LinusRoache,Biography  Drama,SamanthaMorton DexterFletcher LinusRoache JulienTemple Biography  Drama,
groundhog day,HaroldRamis,BillMurray,ChrisElliott,WillieGarson,Comedy  Fantasy  Romance,BillMurray ChrisElliott WillieGarson HaroldRamis Comedy  Fantasy  Romance,
magic mike xxl,GregoryJacobs,MattBomer,ChanningTatum,KevinNash,Comedy  Drama  Music,MattBomer ChanningTatum KevinNash GregoryJacobs Comedy  Drama  Music,
romeo + juliet,BazLuhrmann,LeonardoDiCaprio,HaroldPerrineau,BrianDennehy,Drama  Romance,LeonardoDiCaprio HaroldPerrineau BrianDennehy BazLuhrmann Drama  Romance,
sarah's key,GillesPaquet-Brenner,KristinScottThomas,AidanQuinn,ArbenBajraktaraj,Drama  War,KristinScottThomas AidanQuinn ArbenBajraktaraj GillesPaquet-Brenner Drama  War,
freedom,PeterCousens,SharonLeal,DavidRasche,BartShatto,Drama  Family  Music,SharonLeal DavidRasche BartShatto PeterCousens Drama  Family  Music,
unforgiven,ClintEastwood,ClintEastwood,MorganFreeman,FrancesFisher,Drama  Western,ClintEastwood MorganFreeman FrancesFisher ClintEastwood Drama  Western,
manderlay,LarsvonTrier,BryceDallasHoward,JeremyDavies,Jean-MarcBarr,Drama,BryceDallasHoward JeremyDavies Jean-MarcBarr LarsvonTrier Drama,
slumdog millionaire,DannyBoyle,AnilKapoor,SaurabhShukla,AyushMaheshKhedekar,Drama  Romance,AnilKapoor SaurabhShukla AyushMaheshKhedekar DannyBoyle Drama  Romance,
fatal attraction,AdrianLyne,FredGwynne,LoisSmith,AnneArcher,Drama  Romance  Thriller,FredGwynne LoisSmith AnneArcher AdrianLyne Drama  Romance  Thriller,
pretty woman,GarryMarshall,JuliaRoberts,HectorElizondo,JasonAlexander,Comedy  Romance,JuliaRoberts HectorElizondo JasonAlexander GarryMarshall Comedy  Romance,
towering inferno            ,JohnBlanchard,MartinShort,AndreaMartin,JoeFlaherty,Comedy,MartinShort AndreaMartin JoeFlaherty JohnBlanchard Comedy,
crocodile dundee ii,JohnCornell,PaulHogan,LindaKozlowski,JohnMeillon,Action  Adventure  Comedy,PaulHogan LindaKozlowski JohnMeillon JohnCornell Action  Adventure  Comedy,
broken horses,VidhuVinodChopra,MaríaValverde,ChrisMarquette,ChadBishop,Action  Crime  Drama  Mystery  Thriller,MaríaValverde ChrisMarquette ChadBishop VidhuVinodChopra Action  Crime  Drama  Mystery  Thriller,
born on the fourth of july,OliverStone,TomCruise,TomBerenger,StephenBaldwin,Biography  Drama  War,TomCruise TomBerenger StephenBaldwin OliverStone Biography  Drama  War,
cool runnings,JonTurteltaub,DougE.Doug,Leon,MalikYoba,Adventure  Comedy  Family  Sport,DougE.Doug Leon MalikYoba JonTurteltaub Adventure  Comedy  Family  Sport,
my bloody valentine,PatrickLussier,JensenAckles,JaimeKing,EdiGathegi,Horror  Thriller,JensenAckles JaimeKing EdiGathegi PatrickLussier Horror  Thriller,
the possession,OleBornedal,KyraSedgwick,MadisonDavenport,NatashaCalis,Horror  Thriller,KyraSedgwick MadisonDavenport NatashaCalis OleBornedal Horror  Thriller,
first blood,TedKotcheff,SylvesterStallone,BrianDennehy,ChrisMulkey,Action  Adventure  Drama,SylvesterStallone BrianDennehy ChrisMulkey TedKotcheff Action  Adventure  Drama,
stomp the yard,SylvainWhite,ChrisBrown,LazAlonso,HarryLennix,Drama  Music  Romance,ChrisBrown LazAlonso HarryLennix SylvainWhite Drama  Music  Romance,
the spy who loved me,LewisGilbert,CarolineMunro,DesmondLlewelyn,BarbaraBach,Action  Adventure  Sci-Fi  Thriller,CarolineMunro DesmondLlewelyn BarbaraBach LewisGilbert Action  Adventure  Sci-Fi  Thriller,
ghost hunters            ,unknown,AmyBruni,SteveGonsalves,JasonHawes,Documentary,AmyBruni SteveGonsalves JasonHawes unknown Documentary,
urban legend,JamieBlanks,AliciaWitt,LorettaDevine,JulianRichings,Horror  Mystery  Thriller,AliciaWitt LorettaDevine JulianRichings JamieBlanks Horror  Mystery  Thriller,
dangerous liaisons,StephenFrears,KeanuReeves,PeterCapaldi,SwoosieKurtz,Drama  Romance,KeanuReeves PeterCapaldi SwoosieKurtz StephenFrears Drama  Romance,
good deeds,TylerPerry,EddieCibrian,PhyliciaRashad,JamieKennedy,Comedy  Drama  Romance,EddieCibrian PhyliciaRashad JamieKennedy TylerPerry Comedy  Drama  Romance,
white fang,RandalKleiser,SeymourCassel,KlausMariaBrandauer,SusanHogan,Adventure  Drama,SeymourCassel KlausMariaBrandauer SusanHogan RandalKleiser Adventure  Drama,
superstar,BruceMcCulloch,WillFerrell,ElaineHendrix,MollyShannon,Comedy  Romance,WillFerrell ElaineHendrix MollyShannon BruceMcCulloch Comedy  Romance,
the iron lady,PhyllidaLloyd,MerylStreep,JimBroadbent,OliviaColman,Biography  Drama  History,MerylStreep JimBroadbent OliviaColman PhyllidaLloyd Biography  Drama  History,
jonah: a veggietales movie,MikeNawrocki,PhilVischer,MikeNawrocki,ShelbyVischer,Adventure  Animation  Comedy  Drama  Family  Musical,PhilVischer MikeNawrocki ShelbyVischer MikeNawrocki Adventure  Animation  Comedy  Drama  Family  Musical,
poetic justice,JohnSingleton,JanetJackson,KhandiAlexander,MayaAngelou,Drama  Romance,JanetJackson KhandiAlexander MayaAngelou JohnSingleton Drama  Romance,
all about the benjamins,KevinBray,MikeEpps,RogerGuenveurSmith,GinoSalvano,Action  Comedy  Crime  Thriller,MikeEpps RogerGuenveurSmith GinoSalvano KevinBray Action  Comedy  Crime  Thriller,
vampire in brooklyn,WesCraven,JohnWitherspoon,W.EarlBrown,AllenPayne,Comedy  Fantasy  Horror  Romance,JohnWitherspoon W.EarlBrown AllenPayne WesCraven Comedy  Fantasy  Horror  Romance,
exorcist ii: the heretic,JohnBoorman,LindaBlair,RichardBurton,NedBeatty,Horror,LindaBlair RichardBurton NedBeatty JohnBoorman Horror,
an american haunting,CourtneySolomon,SissySpacek,JamesD'Arcy,VernonDobtcheff,Horror  Mystery  Thriller,SissySpacek JamesD'Arcy VernonDobtcheff CourtneySolomon Horror  Mystery  Thriller,
my boss's daughter,DavidZucker,CarmenElectra,TylerLabine,MollyShannon,Comedy  Romance,CarmenElectra TylerLabine MollyShannon DavidZucker Comedy  Romance,
a perfect getaway,DavidTwohy,ChrisHemsworth,MillaJovovich,MarleyShelton,Adventure  Mystery  Thriller,ChrisHemsworth MillaJovovich MarleyShelton DavidTwohy Adventure  Mystery  Thriller,
our family wedding,RickFamuyiwa,AmericaFerrera,LanceGross,LupeOntiveros,Comedy  Romance,AmericaFerrera LanceGross LupeOntiveros RickFamuyiwa Comedy  Romance,
dead man on campus,AlanCohn,AlysonHannigan,LindaCardellini,PoppyMontgomery,Comedy,AlysonHannigan LindaCardellini PoppyMontgomery AlanCohn Comedy,
tea with mussolini,FrancoZeffirelli,LilyTomlin,JoanPlowright,PaoloSeganti,Comedy  Drama  War,LilyTomlin JoanPlowright PaoloSeganti FrancoZeffirelli Comedy  Drama  War,
thinner,TomHolland,JoeMantegna,BethanyJoyLenz,KariWuhrer,Fantasy  Horror,JoeMantegna BethanyJoyLenz KariWuhrer TomHolland Fantasy  Horror,
